Sheet: BEL
C1: age group of participant
A2: age of contact | C2: 0 | D2: 5 | E2: 10 | F2: 15 | G2: 20 | H2: 25 | I2: 30 | J2: 35 | K2: 40 | L2: 45 | M2: 50 | N2: 55 | O2: 60 | P2: 65 | Q2: 70
B3: 0 | C3: 1.36 | D3: 0.66 | E3: 0.43 | F3: 0.28000000000000003 | G3: 0.1 | H3: 0.44 | I3: 0.8 | J3: 0.74 | K3: 0.18 | L3: 0.22 | M3: 0.39 | N3: 0.46 | O3: 0.34 | P3: 0.32 | Q3: 0.11
B4: 5 | C4: 0.74 | D4: 3.28 | E4: 0.78 | F4: 0.68 | G4: 0.57999999999999996 | H4: 0.09 | I4: 0.68 | J4: 0.69 | K4: 0.21 | L4: 0.06 | M4: 0.39 | N4: 0.23 | O4: 7.0000000000000007E-2 | P4: 0.59 | Q4: 0.15
B5: 10 | C5: 0.42 | D5: 0.76 | E5: 5.6 | F5: 0.81 | G5: 0.46 | H5: 7.0000000000000007E-2 | I5: 0.34 | J5: 1.1299999999999999 | K5: 0.89 | L5: 0.26 | M5: 0.31 | N5: 0.13 | O5: 0.1 | P5: 0.18 | Q5: 0.3
B6: 15 | C6: 0.14000000000000001 | D6: 0.25 | E6: 1.34 | F6: 6.39 | G6: 2.02 | H6: 0.35 | I6: 0.55000000000000004 | J6: 0.44 | K6: 0.92 | L6: 0.76 | M6: 0.33 | N6: 0.27 | O6: 7.0000000000000007E-2 | P6: 0.09 | Q6: 0.33
B7: 20 | C7: 0.34 | D7: 0.17 | E7: 0.7 | F7: 1.67 | G7: 4.4000000000000004 | H7: 0.91 | I7: 0.84 | J7: 0.46 | K7: 0.55000000000000004 | L7: 0.8 | M7: 0.93 | N7: 0.71 | O7: 0.27 | P7: 0.23 | Q7: 7.0000000000000007E-2
B8: 25 | C8: 1.08 | D8: 0.61 | E8: 0.28000000000000003 | F8: 0.72 | G8: 1.77 | H8: 2.2799999999999998 | I8: 1.1599999999999999 | J8: 1.1499999999999999 | K8: 0.89 | L8: 1.08 | M8: 1.3 | N8: 1.1299999999999999 | O8: 0.54 | P8: 0.27 | Q8: 0.3
B9: 30 | C9: 1.46 | D9: 1.29 | E9: 0.56999999999999995 | F9: 0.37 | G9: 1.29 | H9: 1.37 | I9: 2.0699999999999998 | J9: 1.46 | K9: 0.57999999999999996 | L9: 1.06 | M9: 0.74 | N9: 1.77 | O9: 1.2 | P9: 0.41 | Q9: 0.3
B10: 35 | C10: 0.77 | D10: 1.2 | E10: 1.1499999999999999 | F10: 0.73 | G10: 0.56000000000000005 | H10: 1.0900000000000001 | I10: 2.1800000000000002 | J10: 1.67 | K10: 1.29 | L10: 1.46 | M10: 0.83 | N10: 1.27 | O10: 0.76 | P10: 0.91 | Q10: 0.52
B11: 40 | C11: 0.38 | D11: 0.82 | E11: 1.1499999999999999 | F11: 1.1499999999999999 | G11: 0.96 | H11: 0.57999999999999996 | I11: 1.57 | J11: 1.64 | K11: 1.42 | L11: 1 | M11: 1.0900000000000001 | N11: 1.37 | O11: 1.07 | P11: 0.73 | Q11: 0.56000000000000005
B12: 45 | C12: 0.26 | D12: 0.41 | E12: 0.9 | F12: 1.27 | G12: 1.17 | H12: 1.05 | I12: 0.77 | J12: 0.82 | K12: 1.42 | L12: 1.98 | M12: 1.1299999999999999 | N12: 1.06 | O12: 0.83 | P12: 0.27 | Q12: 0.93
B13: 50 | C13: 0.41 | D13: 0.3 | E13: 0.21 | F13: 0.51 | G13: 0.77 | H13: 0.77 | I13: 0.59 | J13: 0.69 | K13: 0.82 | L13: 0.86 | M13: 1.48 | N13: 1.46 | O13: 0.51 | P13: 0.36 | Q13: 0.59
B14: 55 | C14: 0.39 | D14: 0.3 | E14: 0.34 | F14: 0.2 | G14: 0.35 | H14: 0.4 | I14: 0.86 | J14: 0.28000000000000003 | K14: 0.24 | L14: 0.72 | M14: 1.04 | N14: 1.58 | O14: 0.88 | P14: 0.36 | Q14: 0.41
B15: 60 | C15: 0.24 | D15: 0.28999999999999998 | E15: 0.34 | F15: 0.09 | G15: 0.13 | H15: 0.14000000000000001 | I15: 0.39 | J15: 0.51 | K15: 0.28999999999999998 | L15: 0.18 | M15: 0.85 | N15: 0.81 | O15: 1.41 | P15: 0.59 | Q15: 0.93
B16: 65 | C16: 0.16 | D16: 0.16 | E16: 0.16 | F16: 0.13 | G16: 0.17 | H16: 7.0000000000000007E-2 | I16: 0.32 | J16: 0.26 | K16: 0.24 | L16: 0.38 | M16: 0.26 | N16: 0.42 | O16: 0.88 | P16: 0.91 | Q16: 0.59
B17: 70 | C17: 0.23 | D17: 0.2 | E17: 0.3 | F17: 0.15 | G17: 0.31 | H17: 0.3 | I17: 0.43 | J17: 0.33 | K17: 0.82 | L17: 0.92 | M17: 0.8 | N17: 1.08 | O17: 1.1200000000000001 | P17: 1.36 | Q17: 1.48

Sheet: DEU
C1: age group of participant
A2: age of contact | C2: 0 | D2: 5 | E2: 10 | F2: 15 | G2: 20 | H2: 25 | I2: 30 | J2: 35 | K2: 40 | L2: 45 | M2: 50 | N2: 55 | O2: 60 | P2: 65 | Q2: 70
B3: 0 | C3: 1.9 | D3: 0.36 | E3: 0.09 | F3: 0.04 | G3: 0.08 | H3: 0.27 | I3: 0.46 | J3: 0.2 | K3: 0.2 | L3: 0.09 | M3: 0.19 | N3: 7.0000000000000007E-2 | O3: 0.1 | P3: 0.03 | Q3: 7.0000000000000007E-2
B4: 5 | C4: 0.81 | D4: 2.25 | E4: 0.35 | F4: 0.18 | G4: 0.03 | H4: 0.17 | I4: 0.26 | J4: 0.49 | K4: 0.23 | L4: 0.09 | M4: 0.2 | N4: 0.11 | O4: 0.14000000000000001 | P4: 0.11 | Q4: 0.27
B5: 10 | C5: 0.34 | D5: 0.61 | E5: 3.58 | F5: 0.69 | G5: 0.12 | H5: 0.16 | I5: 0.14000000000000001 | J5: 0.62 | K5: 0.67 | L5: 0.35 | M5: 0.16 | N5: 7.0000000000000007E-2 | O5: 7.0000000000000007E-2 | P5: 0.18 | Q5: 0.34
B6: 15 | C6: 0.42 | D6: 0.42 | E6: 0.93 | F6: 4.1900000000000004 | G6: 0.9 | H6: 0.28000000000000003 | I6: 0.19 | J6: 0.46 | K6: 1.1100000000000001 | L6: 1.21 | M6: 0.27 | N6: 0.26 | O6: 0.11 | P6: 0.15 | Q6: 0.49
B7: 20 | C7: 0.56000000000000005 | D7: 0.24 | E7: 0.25 | F7: 1.29 | G7: 2.59 | H7: 1.43 | I7: 0.44 | J7: 0.22 | K7: 0.56999999999999995 | L7: 0.45 | M7: 0.47 | N7: 0.33 | O7: 0.19 | P7: 0.15 | Q7: 0.3
B8: 25 | C8: 0.62 | D8: 0.43 | E8: 0.25 | F8: 0.36 | G8: 1.1399999999999999 | H8: 1.79 | I8: 0.98 | J8: 0.3 | K8: 0.38 | L8: 0.56999999999999995 | M8: 0.6 | N8: 0.45 | O8: 0.32 | P8: 0.19 | Q8: 0.24
B9: 30 | C9: 1.2 | D9: 0.66 | E9: 0.34 | F9: 0.22 | G9: 0.45 | H9: 1.0900000000000001 | I9: 1.49 | J9: 0.74 | K9: 0.56999999999999995 | L9: 0.59 | M9: 0.54 | N9: 0.61 | O9: 0.31 | P9: 0.32 | Q9: 0.41
B10: 35 | C10: 0.87 | D10: 0.77 | E10: 0.65 | F10: 0.6 | G10: 0.45 | H10: 0.77 | I10: 1.18 | J10: 1.43 | K10: 0.95 | L10: 0.7 | M10: 0.57999999999999996 | N10: 0.56999999999999995 | O10: 0.36 | P10: 0.42 | Q10: 0.5
B11: 40 | C11: 0.49 | D11: 0.72 | E11: 0.97 | F11: 0.69 | G11: 0.47 | H11: 0.6 | I11: 0.98 | J11: 1.03 | K11: 1.23 | L11: 1.05 | M11: 0.71 | N11: 0.59 | O11: 0.49 | P11: 0.62 | Q11: 0.52
B12: 45 | C12: 0.4 | D12: 0.38 | E12: 0.44 | F12: 0.68 | G12: 0.63 | H12: 0.77 | I12: 0.32 | J12: 0.59 | K12: 0.93 | L12: 1.23 | M12: 0.99 | N12: 0.62 | O12: 0.44 | P12: 0.38 | Q12: 0.37
B13: 50 | C13: 0.38 | D13: 0.23 | E13: 0.37 | F13: 0.39 | G13: 0.41 | H13: 0.59 | I13: 0.67 | J13: 0.36 | K13: 0.47 | L13: 0.82 | M13: 1.18 | N13: 0.79 | O13: 0.4 | P13: 0.45 | Q13: 0.38
B14: 55 | C14: 0.26 | D14: 0.26 | E14: 0.15 | F14: 0.26 | G14: 0.26 | H14: 0.59 | I14: 0.35 | J14: 0.28000000000000003 | K14: 0.22 | L14: 0.41 | M14: 0.79 | N14: 1.1200000000000001 | O14: 0.75 | P14: 0.35 | Q14: 0.31
B15: 60 | C15: 0.27 | D15: 0.22 | E15: 0.19 | F15: 0.12 | G15: 0.11 | H15: 0.49 | I15: 0.42 | J15: 0.36 | K15: 0.32 | L15: 0.28000000000000003 | M15: 0.42 | N15: 0.54 | O15: 0.85 | P15: 0.8 | Q15: 0.43
B16: 65 | C16: 0.19 | D16: 0.18 | E16: 0.19 | F16: 0.15 | G16: 0.08 | H16: 0.23 | I16: 0.19 | J16: 0.3 | K16: 0.2 | L16: 0.15 | M16: 0.18 | N16: 0.3 | O16: 0.52 | P16: 0.91 | Q16: 0.44
B17: 70 | C17: 0.38 | D17: 0.63 | E17: 0.24 | F17: 0.14000000000000001 | G17: 0.19 | H17: 0.28000000000000003 | I17: 0.21 | J17: 0.22 | K17: 0.4 | L17: 0.26 | M17: 0.28000000000000003 | N17: 0.34 | O17: 0.37 | P17: 1.3 | Q17: 0.76

Sheet: FIN
C1: age group of participant
A2: age of contact | C2: 0 | D2: 5 | E2: 10 | F2: 15 | G2: 20 | H2: 25 | I2: 30 | J2: 35 | K2: 40 | L2: 45 | M2: 50 | N2: 55 | O2: 60 | P2: 65 | Q2: 70
B3: 0 | C3: 1.97 | D3: 1.32 | E3: 0.36 | F3: 0.3 | G3: 0.28999999999999998 | H3: 0.75 | I3: 0.92 | J3: 0.73 | K3: 0.2 | L3: 0.23 | M3: 0.25 | N3: 0.13 | O3: 0.4 | P3: 0.08 | Q3: 0.23
B4: 5 | C4: 1.0900000000000001 | D4: 4.8 | E4: 1.22 | F4: 0.36 | G4: 0.02 | H4: 0.37 | I4: 0.43 | J4: 0.77 | K4: 0.4 | L4: 0.39 | M4: 0.22 | N4: 0.12 | O4: 0.18 | P4: 0.17 | Q4: 0.04
B5: 10 | C5: 0.4 | D5: 1.57 | E5: 8.48 | F5: 1.55 | G5: 0.21 | H5: 0.05 | I5: 0.42 | J5: 0.81 | K5: 0.88 | L5: 0.63 | M5: 0.2 | N5: 0.13 | O5: 0.08 | P5: 0.25 | Q5: 0.08
B6: 15 | C6: 0.21 | D6: 0.23 | E6: 1.04 | F6: 4.5599999999999996 | G6: 1.0900000000000001 | H6: 0.35 | I6: 0.1 | J6: 0.35 | K6: 0.6 | L6: 0.66 | M6: 0.49 | N6: 0.17 | O6: 0.08 | P6: 0.09 | Q6: 0.15
B7: 20 | C7: 0.18 | D7: 0.33 | E7: 0.22 | F7: 1.0900000000000001 | G7: 2.71 | H7: 1.49 | I7: 0.7 | J7: 0.71 | K7: 0.56999999999999995 | L7: 0.89 | M7: 0.59 | N7: 0.32 | O7: 0.27 | P7: 0.28000000000000003 | Q7: 0.15
B8: 25 | C8: 0.71 | D8: 0.4 | E8: 0.34 | F8: 0.51 | G8: 1.45 | H8: 2.09 | I8: 0.95 | J8: 1.39 | K8: 0.77 | L8: 0.55000000000000004 | M8: 1 | N8: 0.72 | O8: 0.45 | P8: 0.39 | Q8: 0.35
B9: 30 | C9: 0.88 | D9: 0.87 | E9: 0.54 | F9: 0.44 | G9: 0.79 | H9: 1.3 | I9: 1.57 | J9: 1.58 | K9: 0.83 | L9: 1 | M9: 1.1499999999999999 | N9: 0.88 | O9: 0.69 | P9: 0.39 | Q9: 0.15
B10: 35 | C10: 0.84 | D10: 1.01 | E10: 0.78 | F10: 0.57999999999999996 | G10: 0.5 | H10: 1.05 | I10: 1.25 | J10: 2.06 | K10: 1 | L10: 0.84 | M10: 0.71 | N10: 0.83 | O10: 0.69 | P10: 0.36 | Q10: 0.31
B11: 40 | C11: 0.6 | D11: 1.0900000000000001 | E11: 1.39 | F11: 0.72 | G11: 0.6 | H11: 0.81 | I11: 0.88 | J11: 1.71 | K11: 2.08 | L11: 1.45 | M11: 1.32 | N11: 1.07 | O11: 0.63 | P11: 0.33 | Q11: 0.46
B12: 45 | C12: 0.49 | D12: 0.52 | E12: 0.81 | F12: 1.17 | G12: 0.62 | H12: 0.84 | I12: 0.9 | J12: 1.18 | K12: 1.5 | L12: 1.33 | M12: 1.49 | N12: 0.92 | O12: 0.47 | P12: 0.3 | Q12: 0.23
B13: 50 | C13: 0.44 | D13: 0.47 | E13: 0.48 | F13: 0.53 | G13: 0.62 | H13: 1.02 | I13: 0.8 | J13: 1.4 | K13: 1.58 | L13: 1.1299999999999999 | M13: 1.64 | N13: 1.45 | O13: 0.6 | P13: 0.36 | Q13: 0.35
B14: 55 | C14: 0.33 | D14: 0.28999999999999998 | E14: 0.21 | F14: 0.39 | G14: 0.33 | H14: 0.49 | I14: 0.78 | J14: 0.5 | K14: 0.57999999999999996 | L14: 0.55000000000000004 | M14: 1.46 | N14: 1.28 | O14: 0.82 | P14: 0.5 | Q14: 0.23
B15: 60 | C15: 0.38 | D15: 0.25 | E15: 0.11 | F15: 0.11 | G15: 7.0000000000000007E-2 | H15: 0.25 | I15: 0.52 | J15: 0.35 | K15: 0.18 | L15: 0.42 | M15: 0.66 | N15: 0.52 | O15: 1.27 | P15: 0.57999999999999996 | Q15: 0.46
B16: 65 | C16: 0.19 | D16: 0.22 | E16: 0.08 | F16: 7.0000000000000007E-2 | G16: 0.09 | H16: 0.09 | I16: 0.13 | J16: 0.21 | K16: 0.25 | L16: 0.13 | M16: 0.19 | N16: 0.27 | O16: 0.53 | P16: 0.77 | Q16: 0.81
B17: 70 | C17: 0.15 | D17: 0.19 | E17: 0.21 | F17: 0.15 | G17: 0.12 | H17: 0.14000000000000001 | I17: 0.25 | J17: 0.23 | K17: 0.43 | L17: 0.3 | M17: 0.37 | N17: 0.4 | O17: 0.6 | P17: 0.88 | Q17: 1.69

Sheet: GBR
C1: age group of participant
A2: age of contact | C2: 0 | D2: 5 | E2: 10 | F2: 15 | G2: 20 | H2: 25 | I2: 30 | J2: 35 | K2: 40 | L2: 45 | M2: 50 | N2: 55 | O2: 60 | P2: 65 | Q2: 70 | R2: 75 | S2: 80 | T2: 85 | U2: 90
B3: 0 | C3: 1.92 | D3: 0.65 | E3: 0.41 | F3: 0.24 | G3: 0.46 | H3: 0.73 | I3: 0.67 | J3: 0.83 | K3: 0.24 | L3: 0.22 | M3: 0.36 | N3: 0.2 | O3: 0.2 | P3: 0.26 | Q3: 0.13 | R3: =RC[-1]*'[age-dist(GBR_uk-office-of-national-statistics_ONS).csv]age-dist(GBR_uk-office-of-natio'!R17C6 -> 9.0887341589167836E-2 | S3: =RC[-1]*'[age-dist(GBR_uk-office-of-national-statistics_ONS).csv]age-dist(GBR_uk-office-of-natio'!R18C6 -> 4.6952766497499188E-2 | T3: =RC[-1]*'[age-dist(GBR_uk-office-of-national-statistics_ONS).csv]age-dist(GBR_uk-office-of-natio'!R19C6 -> 1.4750710899106635E-2 | U3: =RC[-1]*'[age-dist(GBR_uk-office-of-national-statistics_ONS).csv]age-dist(GBR_uk-office-of-natio'!R20C6 -> 2.694779904896024E-3
B4: 5 | C4: 0.95 | D4: 6.64 | E4: 1.0900000000000001 | F4: 0.73 | G4: 0.61 | H4: 0.75 | I4: 0.95 | J4: 1.39 | K4: 0.9 | L4: 0.16 | M4: 0.3 | N4: 0.22 | O4: 0.5 | P4: 0.48 | Q4: 0.2 | R4: =RC[-1]*'[age-dist(GBR_uk-office-of-national-statistics_ONS).csv]age-dist(GBR_uk-office-of-natio'!R17C6 -> 0.13982667936795051 | S4: =RC[-1]*'[age-dist(GBR_uk-office-of-national-statistics_ONS).csv]age-dist(GBR_uk-office-of-natio'!R18C6 -> 7.2235025380767981E-2 | T4: =RC[-1]*'[age-dist(GBR_uk-office-of-national-statistics_ONS).csv]age-dist(GBR_uk-office-of-natio'!R19C6 -> 2.2693401383240976E-2 | U4: =RC[-1]*'[age-dist(GBR_uk-office-of-national-statistics_ONS).csv]age-dist(GBR_uk-office-of-natio'!R20C6 -> 4.1458152383015753E-3
B5: 10 | C5: 0.48 | D5: 1.31 | E5: 6.85 | F5: 1.52 | G5: 0.27 | H5: 0.31 | I5: 0.48 | J5: 0.76 | K5: 1 | L5: 0.69 | M5: 0.32 | N5: 0.44 | O5: 0.27 | P5: 0.41 | Q5: 0.33 | R5: =RC[-1]*'[age-dist(GBR_uk-office-of-national-statistics_ONS).csv]age-dist(GBR_uk-office-of-natio'!R17C6 -> 0.23071402095711835 | S5: =RC[-1]*'[age-dist(GBR_uk-office-of-national-statistics_ONS).csv]age-dist(GBR_uk-office-of-natio'!R18C6 -> 0.11918779187826717 | T5: =RC[-1]*'[age-dist(GBR_uk-office-of-national-statistics_ONS).csv]age-dist(GBR_uk-office-of-natio'!R19C6 -> 3.7444112282347612E-2 | U5: =RC[-1]*'[age-dist(GBR_uk-office-of-national-statistics_ONS).csv]age-dist(GBR_uk-office-of-natio'!R20C6 -> 6.8405951431976001E-3
B6: 15 | C6: 0.33 | D6: 0.34 | E6: 1.03 | F6: 6.71 | G6: 1.58 | H6: 0.73 | I6: 0.42 | J6: 0.56000000000000005 | K6: 0.85 | L6: 1.1599999999999999 | M6: 0.7 | N6: 0.3 | O6: 0.2 | P6: 0.48 | Q6: 0.63 | R6: =RC[-1]*'[age-dist(GBR_uk-office-of-national-statistics_ONS).csv]age-dist(GBR_uk-office-of-natio'!R17C6 -> 0.44045404000904409 | S6: =RC[-1]*'[age-dist(GBR_uk-office-of-national-statistics_ONS).csv]age-dist(GBR_uk-office-of-natio'!R18C6 -> 0.22754032994941914 | T6: =RC[-1]*'[age-dist(GBR_uk-office-of-national-statistics_ONS).csv]age-dist(GBR_uk-office-of-natio'!R19C6 -> 7.1484214357209072E-2 | U6: =RC[-1]*'[age-dist(GBR_uk-office-of-national-statistics_ONS).csv]age-dist(GBR_uk-office-of-natio'!R20C6 -> 1.3059318000649963E-2
B7: 20 | C7: 0.45 | D7: 0.3 | E7: 0.22 | F7: 0.93 | G7: 2.59 | H7: 1.49 | I7: 0.75 | J7: 0.63 | K7: 0.77 | L7: 0.87 | M7: 0.88 | N7: 0.61 | O7: 0.53 | P7: 0.37 | Q7: 0.33 | R7: =RC[-1]*'[age-dist(GBR_uk-office-of-national-statistics_ONS).csv]age-dist(GBR_uk-office-of-natio'!R17C6 -> 0.23071402095711835 | S7: =RC[-1]*'[age-dist(GBR_uk-office-of-national-statistics_ONS).csv]age-dist(GBR_uk-office-of-natio'!R18C6 -> 0.11918779187826717 | T7: =RC[-1]*'[age-dist(GBR_uk-office-of-national-statistics_ONS).csv]age-dist(GBR_uk-office-of-natio'!R19C6 -> 3.7444112282347612E-2 | U7: =RC[-1]*'[age-dist(GBR_uk-office-of-national-statistics_ONS).csv]age-dist(GBR_uk-office-of-natio'!R20C6 -> 6.8405951431976001E-3
B8: 25 | C8: 0.79 | D8: 0.66 | E8: 0.44 | F8: 0.74 | G8: 1.29 | H8: 1.83 | I8: 0.97 | J8: 0.71 | K8: 0.74 | L8: 0.85 | M8: 0.88 | N8: 0.87 | O8: 0.67 | P8: 0.74 | Q8: 0.33 | R8: =RC[-1]*'[age-dist(GBR_uk-office-of-national-statistics_ONS).csv]age-dist(GBR_uk-office-of-natio'!R17C6 -> 0.23071402095711835 | S8: =RC[-1]*'[age-dist(GBR_uk-office-of-national-statistics_ONS).csv]age-dist(GBR_uk-office-of-natio'!R18C6 -> 0.11918779187826717 | T8: =RC[-1]*'[age-dist(GBR_uk-office-of-national-statistics_ONS).csv]age-dist(GBR_uk-office-of-natio'!R19C6 -> 3.7444112282347612E-2 | U8: =RC[-1]*'[age-dist(GBR_uk-office-of-national-statistics_ONS).csv]age-dist(GBR_uk-office-of-natio'!R20C6 -> 6.8405951431976001E-3
B9: 30 | C9: 0.97 | D9: 1.07 | E9: 0.62 | F9: 0.5 | G9: 0.88 | H9: 1.19 | I9: 1.67 | J9: 0.89 | K9: 1.02 | L9: 0.91 | M9: 0.92 | N9: 0.61 | O9: 0.76 | P9: 0.63 | Q9: 0.27 | R9: =RC[-1]*'[age-dist(GBR_uk-office-of-national-statistics_ONS).csv]age-dist(GBR_uk-office-of-natio'!R17C6 -> 0.18876601714673319 | S9: =RC[-1]*'[age-dist(GBR_uk-office-of-national-statistics_ONS).csv]age-dist(GBR_uk-office-of-natio'!R18C6 -> 9.7517284264036774E-2 | T9: =RC[-1]*'[age-dist(GBR_uk-office-of-national-statistics_ONS).csv]age-dist(GBR_uk-office-of-natio'!R19C6 -> 3.0636091867375318E-2 | U9: =RC[-1]*'[age-dist(GBR_uk-office-of-national-statistics_ONS).csv]age-dist(GBR_uk-office-of-natio'!R20C6 -> 5.5968505717071274E-3
B10: 35 | C10: 1.02 | D10: 0.98 | E10: 1.26 | F10: 1.0900000000000001 | G10: 0.76 | H10: 0.95 | I10: 1.53 | J10: 1.5 | K10: 1.32 | L10: 1.0900000000000001 | M10: 0.83 | N10: 0.69 | O10: 1.02 | P10: 0.96 | Q10: 0.2 | R10: =RC[-1]*'[age-dist(GBR_uk-office-of-national-statistics_ONS).csv]age-dist(GBR_uk-office-of-natio'!R17C6 -> 0.13982667936795051 | S10: =RC[-1]*'[age-dist(GBR_uk-office-of-national-statistics_ONS).csv]age-dist(GBR_uk-office-of-natio'!R18C6 -> 7.2235025380767981E-2 | T10: =RC[-1]*'[age-dist(GBR_uk-office-of-national-statistics_ONS).csv]age-dist(GBR_uk-office-of-natio'!R19C6 -> 2.2693401383240976E-2 | U10: =RC[-1]*'[age-dist(GBR_uk-office-of-national-statistics_ONS).csv]age-dist(GBR_uk-office-of-natio'!R20C6 -> 4.1458152383015753E-3
B11: 40 | C11: 0.55000000000000004 | D11: 1 | E11: 1.1399999999999999 | F11: 0.94 | G11: 0.73 | H11: 0.88 | I11: 0.82 | J11: 1.23 | K11: 1.35 | L11: 1.27 | M11: 0.89 | N11: 0.67 | O11: 0.94 | P11: 0.81 | Q11: 0.8 | R11: =RC[-1]*'[age-dist(GBR_uk-office-of-national-statistics_ONS).csv]age-dist(GBR_uk-office-of-natio'!R17C6 -> 0.55930671747180205 | S11: =RC[-1]*'[age-dist(GBR_uk-office-of-national-statistics_ONS).csv]age-dist(GBR_uk-office-of-natio'!R18C6 -> 0.28894010152307192 | T11: =RC[-1]*'[age-dist(GBR_uk-office-of-national-statistics_ONS).csv]age-dist(GBR_uk-office-of-natio'!R19C6 -> 9.0773605532963902E-2 | U11: =RC[-1]*'[age-dist(GBR_uk-office-of-national-statistics_ONS).csv]age-dist(GBR_uk-office-of-natio'!R20C6 -> 1.6583260953206301E-2
B12: 45 | C12: 0.28999999999999998 | D12: 0.54 | E12: 0.56999999999999995 | F12: 0.77 | G12: 0.97 | H12: 0.93 | I12: 0.56999999999999995 | J12: 0.8 | K12: 1.32 | L12: 1.87 | M12: 0.61 | N12: 0.8 | O12: 0.61 | P12: 0.59 | Q12: 0.56999999999999995 | R12: =RC[-1]*'[age-dist(GBR_uk-office-of-national-statistics_ONS).csv]age-dist(GBR_uk-office-of-natio'!R17C6 -> 0.39850603619865888 | S12: =RC[-1]*'[age-dist(GBR_uk-office-of-national-statistics_ONS).csv]age-dist(GBR_uk-office-of-natio'!R18C6 -> 0.20586982233518872 | T12: =RC[-1]*'[age-dist(GBR_uk-office-of-national-statistics_ONS).csv]age-dist(GBR_uk-office-of-natio'!R19C6 -> 6.4676193942236782E-2 | U12: =RC[-1]*'[age-dist(GBR_uk-office-of-national-statistics_ONS).csv]age-dist(GBR_uk-office-of-natio'!R20C6 -> 1.181557342915949E-2
B13: 50 | C13: 0.33 | D13: 0.38 | E13: 0.4 | F13: 0.41 | G13: 0.44 | H13: 0.85 | I13: 0.6 | J13: 0.61 | K13: 0.71 | L13: 0.95 | M13: 0.74 | N13: 1.06 | O13: 0.59 | P13: 0.56000000000000005 | Q13: 0.56999999999999995 | R13: =RC[-1]*'[age-dist(GBR_uk-office-of-national-statistics_ONS).csv]age-dist(GBR_uk-office-of-natio'!R17C6 -> 0.39850603619865888 | S13: =RC[-1]*'[age-dist(GBR_uk-office-of-national-statistics_ONS).csv]age-dist(GBR_uk-office-of-natio'!R18C6 -> 0.20586982233518872 | T13: =RC[-1]*'[age-dist(GBR_uk-office-of-national-statistics_ONS).csv]age-dist(GBR_uk-office-of-natio'!R19C6 -> 6.4676193942236782E-2 | U13: =RC[-1]*'[age-dist(GBR_uk-office-of-national-statistics_ONS).csv]age-dist(GBR_uk-office-of-natio'!R20C6 -> 1.181557342915949E-2
B14: 55 | C14: 0.31 | D14: 0.21 | E14: 0.25 | F14: 0.33 | G14: 0.39 | H14: 0.53 | I14: 0.68 | J14: 0.53 | K14: 0.55000000000000004 | L14: 0.51 | M14: 0.82 | N14: 1.17 | O14: 0.85 | P14: 0.85 | Q14: 0.33 | R14: =RC[-1]*'[age-dist(GBR_uk-office-of-national-statistics_ONS).csv]age-dist(GBR_uk-office-of-natio'!R17C6 -> 0.23071402095711835 | S14: =RC[-1]*'[age-dist(GBR_uk-office-of-national-statistics_ONS).csv]age-dist(GBR_uk-office-of-natio'!R18C6 -> 0.11918779187826717 | T14: =RC[-1]*'[age-dist(GBR_uk-office-of-national-statistics_ONS).csv]age-dist(GBR_uk-office-of-natio'!R19C6 -> 3.7444112282347612E-2 | U14: =RC[-1]*'[age-dist(GBR_uk-office-of-national-statistics_ONS).csv]age-dist(GBR_uk-office-of-natio'!R20C6 -> 6.8405951431976001E-3
B15: 60 | C15: 0.26 | D15: 0.25 | E15: 0.19 | F15: 0.24 | G15: 0.19 | H15: 0.34 | I15: 0.4 | J15: 0.39 | K15: 0.47 | L15: 0.55000000000000004 | M15: 0.41 | N15: 0.78 | O15: 0.65 | P15: 0.85 | Q15: 0.56999999999999995 | R15: =RC[-1]*'[age-dist(GBR_uk-office-of-national-statistics_ONS).csv]age-dist(GBR_uk-office-of-natio'!R17C6 -> 0.39850603619865888 | S15: =RC[-1]*'[age-dist(GBR_uk-office-of-national-statistics_ONS).csv]age-dist(GBR_uk-office-of-natio'!R18C6 -> 0.20586982233518872 | T15: =RC[-1]*'[age-dist(GBR_uk-office-of-national-statistics_ONS).csv]age-dist(GBR_uk-office-of-natio'!R19C6 -> 6.4676193942236782E-2 | U15: =RC[-1]*'[age-dist(GBR_uk-office-of-national-statistics_ONS).csv]age-dist(GBR_uk-office-of-natio'!R20C6 -> 1.181557342915949E-2
B16: 65 | C16: 0.09 | D16: 0.11 | E16: 0.12 | F16: 0.2 | G16: 0.19 | H16: 0.22 | I16: 0.13 | J16: 0.3 | K16: 0.23 | L16: 0.13 | M16: 0.21 | N16: 0.28000000000000003 | O16: 0.36 | P16: 0.7 | Q16: 0.6 | R16: =RC[-1]*'[age-dist(GBR_uk-office-of-national-statistics_ONS).csv]age-dist(GBR_uk-office-of-natio'!R17C6 -> 0.41948003810385148 | S16: =RC[-1]*'[age-dist(GBR_uk-office-of-national-statistics_ONS).csv]age-dist(GBR_uk-office-of-natio'!R18C6 -> 0.21670507614230392 | T16: =RC[-1]*'[age-dist(GBR_uk-office-of-national-statistics_ONS).csv]age-dist(GBR_uk-office-of-natio'!R19C6 -> 6.808020414972292E-2 | U16: =RC[-1]*'[age-dist(GBR_uk-office-of-national-statistics_ONS).csv]age-dist(GBR_uk-office-of-natio'!R20C6 -> 1.2437445714904726E-2
B17: 70 | C17: 0.14000000000000001 | D17: 0.15 | E17: 0.21 | F17: 0.1 | G17: 0.24 | H17: 0.17 | I17: 0.15 | J17: 0.41 | K17: 0.5 | L17: 0.71 | M17: 0.53 | N17: 0.76 | O17: 0.47 | P17: 0.74 | Q17: 1.47 | R17: =RC[-1]*'[age-dist(GBR_uk-office-of-national-statistics_ONS).csv]age-dist(GBR_uk-office-of-natio'!R17C6 -> 1.0277260933544361 | S17: =RC[-1]*'[age-dist(GBR_uk-office-of-national-statistics_ONS).csv]age-dist(GBR_uk-office-of-natio'!R18C6 -> 0.5309274365486446 | T17: =RC[-1]*'[age-dist(GBR_uk-office-of-national-statistics_ONS).csv]age-dist(GBR_uk-office-of-natio'!R19C6 -> 0.16679650016682115 | U17: =RC[-1]*'[age-dist(GBR_uk-office-of-national-statistics_ONS).csv]age-dist(GBR_uk-office-of-natio'!R20C6 -> 3.0471742001516578E-2
B18: 75 | C18: =R[-1]C*'[age-dist(GBR_uk-office-of-national-statistics_ONS).csv]age-dist(GBR_uk-office-of-natio'!R17C6 -> 9.7878675557565367E-2 | D18: =R[-1]C*'[age-dist(GBR_uk-office-of-national-statistics_ONS).csv]age-dist(GBR_uk-office-of-natio'!R17C6 -> 0.10487000952596287 | E18: =R[-1]C*'[age-dist(GBR_uk-office-of-national-statistics_ONS).csv]age-dist(GBR_uk-office-of-natio'!R17C6 -> 0.14681801333634803 | F18: =R[-1]C*'[age-dist(GBR_uk-office-of-national-statistics_ONS).csv]age-dist(GBR_uk-office-of-natio'!R17C6 -> 6.9913339683975256E-2 | G18: =R[-1]C*'[age-dist(GBR_uk-office-of-national-statistics_ONS).csv]age-dist(GBR_uk-office-of-natio'!R17C6 -> 0.16779201524154058 | H18: =R[-1]C*'[age-dist(GBR_uk-office-of-national-statistics_ONS).csv]age-dist(GBR_uk-office-of-natio'!R17C6 -> 0.11885267746275793 | I18: =R[-1]C*'[age-dist(GBR_uk-office-of-national-statistics_ONS).csv]age-dist(GBR_uk-office-of-natio'!R17C6 -> 0.10487000952596287 | J18: =R[-1]C*'[age-dist(GBR_uk-office-of-national-statistics_ONS).csv]age-dist(GBR_uk-office-of-natio'!R17C6 -> 0.28664469270429849 | K18: =R[-1]C*'[age-dist(GBR_uk-office-of-national-statistics_ONS).csv]age-dist(GBR_uk-office-of-natio'!R17C6 -> 0.34956669841987625 | L18: =R[-1]C*'[age-dist(GBR_uk-office-of-national-statistics_ONS).csv]age-dist(GBR_uk-office-of-natio'!R17C6 -> 0.49638471175622423 | M18: =R[-1]C*'[age-dist(GBR_uk-office-of-national-statistics_ONS).csv]age-dist(GBR_uk-office-of-natio'!R17C6 -> 0.37054070032506886 | N18: =R[-1]C*'[age-dist(GBR_uk-office-of-national-statistics_ONS).csv]age-dist(GBR_uk-office-of-natio'!R17C6 -> 0.53134138159821187 | O18: =R[-1]C*'[age-dist(GBR_uk-office-of-national-statistics_ONS).csv]age-dist(GBR_uk-office-of-natio'!R17C6 -> 0.32859269651468365 | P18: =R[-1]C*'[age-dist(GBR_uk-office-of-national-statistics_ONS).csv]age-dist(GBR_uk-office-of-natio'!R17C6 -> 0.51735871366141684 | Q18: =R[-1]C*'[age-dist(GBR_uk-office-of-national-statistics_ONS).csv]age-dist(GBR_uk-office-of-natio'!R17C6 -> 1.0277260933544361 | R18: =R[-1]C*'[age-dist(GBR_uk-office-of-national-statistics_ONS).csv]age-dist(GBR_uk-office-of-natio'!R17C6 -> 0.71851763466773555 | S18: =R[-1]C*'[age-dist(GBR_uk-office-of-national-statistics_ONS).csv]age-dist(GBR_uk-office-of-natio'!R17C6 -> 0.37118910218967605 | T18: =R[-1]C*'[age-dist(GBR_uk-office-of-national-statistics_ONS).csv]age-dist(GBR_uk-office-of-natio'!R17C6 -> 0.11661300374261202 | U18: =R[-1]C*'[age-dist(GBR_uk-office-of-national-statistics_ONS).csv]age-dist(GBR_uk-office-of-natio'!R17C6 -> 2.1303812493144843E-2
B19: 80 | C19: =R[-1]C*'[age-dist(GBR_uk-office-of-national-statistics_ONS).csv]age-dist(GBR_uk-office-of-natio'!R18C6 -> 5.0564517766537594E-2 | D19: =R[-1]C*'[age-dist(GBR_uk-office-of-national-statistics_ONS).csv]age-dist(GBR_uk-office-of-natio'!R18C6 -> 5.4176269035575979E-2 | E19: =R[-1]C*'[age-dist(GBR_uk-office-of-national-statistics_ONS).csv]age-dist(GBR_uk-office-of-natio'!R18C6 -> 7.584677664980638E-2 | F19: =R[-1]C*'[age-dist(GBR_uk-office-of-national-statistics_ONS).csv]age-dist(GBR_uk-office-of-natio'!R18C6 -> 3.611751269038399E-2 | G19: =R[-1]C*'[age-dist(GBR_uk-office-of-national-statistics_ONS).csv]age-dist(GBR_uk-office-of-natio'!R18C6 -> 8.6682030456921563E-2 | H19: =R[-1]C*'[age-dist(GBR_uk-office-of-national-statistics_ONS).csv]age-dist(GBR_uk-office-of-natio'!R18C6 -> 6.1399771573652784E-2 | I19: =R[-1]C*'[age-dist(GBR_uk-office-of-national-statistics_ONS).csv]age-dist(GBR_uk-office-of-natio'!R18C6 -> 5.4176269035575979E-2 | J19: =R[-1]C*'[age-dist(GBR_uk-office-of-national-statistics_ONS).csv]age-dist(GBR_uk-office-of-natio'!R18C6 -> 0.14808180203057433 | K19: =R[-1]C*'[age-dist(GBR_uk-office-of-national-statistics_ONS).csv]age-dist(GBR_uk-office-of-natio'!R18C6 -> 0.18058756345191995 | L19: =R[-1]C*'[age-dist(GBR_uk-office-of-national-statistics_ONS).csv]age-dist(GBR_uk-office-of-natio'!R18C6 -> 0.25643434010172628 | M19: =R[-1]C*'[age-dist(GBR_uk-office-of-national-statistics_ONS).csv]age-dist(GBR_uk-office-of-natio'!R18C6 -> 0.19142281725903515 | N19: =R[-1]C*'[age-dist(GBR_uk-office-of-national-statistics_ONS).csv]age-dist(GBR_uk-office-of-natio'!R18C6 -> 0.27449309644691827 | O19: =R[-1]C*'[age-dist(GBR_uk-office-of-national-statistics_ONS).csv]age-dist(GBR_uk-office-of-natio'!R18C6 -> 0.16975230964480473 | P19: =R[-1]C*'[age-dist(GBR_uk-office-of-national-statistics_ONS).csv]age-dist(GBR_uk-office-of-natio'!R18C6 -> 0.26726959390884153 | Q19: =R[-1]C*'[age-dist(GBR_uk-office-of-national-statistics_ONS).csv]age-dist(GBR_uk-office-of-natio'!R18C6 -> 0.5309274365486446 | R19: =R[-1]C*'[age-dist(GBR_uk-office-of-national-statistics_ONS).csv]age-dist(GBR_uk-office-of-natio'!R18C6 -> 0.3711891021896761 | S19: =R[-1]C*'[age-dist(GBR_uk-office-of-national-statistics_ONS).csv]age-dist(GBR_uk-office-of-natio'!R18C6 -> 0.19175778427218709 | T19: =R[-1]C*'[age-dist(GBR_uk-office-of-national-statistics_ONS).csv]age-dist(GBR_uk-office-of-natio'!R18C6 -> 6.0242747114867982E-2 | U19: =R[-1]C*'[age-dist(GBR_uk-office-of-national-statistics_ONS).csv]age-dist(GBR_uk-office-of-natio'!R18C6 -> 1.1005635284378817E-2
B20: 85 | C20: =R[-1]C*'[age-dist(GBR_uk-office-of-national-statistics_ONS).csv]age-dist(GBR_uk-office-of-natio'!R19C6 -> 1.5885380968268685E-2 | D20: =R[-1]C*'[age-dist(GBR_uk-office-of-national-statistics_ONS).csv]age-dist(GBR_uk-office-of-natio'!R19C6 -> 1.702005103743073E-2 | E20: =R[-1]C*'[age-dist(GBR_uk-office-of-national-statistics_ONS).csv]age-dist(GBR_uk-office-of-natio'!R19C6 -> 2.3828071452403024E-2 | F20: =R[-1]C*'[age-dist(GBR_uk-office-of-national-statistics_ONS).csv]age-dist(GBR_uk-office-of-natio'!R19C6 -> 1.1346700691620488E-2 | G20: =R[-1]C*'[age-dist(GBR_uk-office-of-national-statistics_ONS).csv]age-dist(GBR_uk-office-of-natio'!R19C6 -> 2.7232081659889169E-2 | H20: =R[-1]C*'[age-dist(GBR_uk-office-of-national-statistics_ONS).csv]age-dist(GBR_uk-office-of-natio'!R19C6 -> 1.928939117575483E-2 | I20: =R[-1]C*'[age-dist(GBR_uk-office-of-national-statistics_ONS).csv]age-dist(GBR_uk-office-of-natio'!R19C6 -> 1.702005103743073E-2 | J20: =R[-1]C*'[age-dist(GBR_uk-office-of-national-statistics_ONS).csv]age-dist(GBR_uk-office-of-natio'!R19C6 -> 4.6521472835643993E-2 | K20: =R[-1]C*'[age-dist(GBR_uk-office-of-national-statistics_ONS).csv]age-dist(GBR_uk-office-of-natio'!R19C6 -> 5.6733503458102442E-2 | L20: =R[-1]C*'[age-dist(GBR_uk-office-of-national-statistics_ONS).csv]age-dist(GBR_uk-office-of-natio'!R19C6 -> 8.0561574910505446E-2 | M20: =R[-1]C*'[age-dist(GBR_uk-office-of-national-statistics_ONS).csv]age-dist(GBR_uk-office-of-natio'!R19C6 -> 6.0137513665588588E-2 | N20: =R[-1]C*'[age-dist(GBR_uk-office-of-national-statistics_ONS).csv]age-dist(GBR_uk-office-of-natio'!R19C6 -> 8.6234925256315695E-2 | O20: =R[-1]C*'[age-dist(GBR_uk-office-of-national-statistics_ONS).csv]age-dist(GBR_uk-office-of-natio'!R19C6 -> 5.332949325061629E-2 | P20: =R[-1]C*'[age-dist(GBR_uk-office-of-national-statistics_ONS).csv]age-dist(GBR_uk-office-of-natio'!R19C6 -> 8.3965585117991612E-2 | Q20: =R[-1]C*'[age-dist(GBR_uk-office-of-national-statistics_ONS).csv]age-dist(GBR_uk-office-of-natio'!R19C6 -> 0.16679650016682115 | R20: =R[-1]C*'[age-dist(GBR_uk-office-of-national-statistics_ONS).csv]age-dist(GBR_uk-office-of-natio'!R19C6 -> 0.11661300374261203 | S20: =R[-1]C*'[age-dist(GBR_uk-office-of-national-statistics_ONS).csv]age-dist(GBR_uk-office-of-natio'!R19C6 -> 6.0242747114867976E-2 | T20: =R[-1]C*'[age-dist(GBR_uk-office-of-national-statistics_ONS).csv]age-dist(GBR_uk-office-of-natio'!R19C6 -> 1.8925899638027464E-2 | U20: =R[-1]C*'[age-dist(GBR_uk-office-of-national-statistics_ONS).csv]age-dist(GBR_uk-office-of-natio'!R19C6 -> 3.4575373604348921E-3
B21: 90 | C21: =R[-1]C*'[age-dist(GBR_uk-office-of-national-statistics_ONS).csv]age-dist(GBR_uk-office-of-natio'!R20C6 -> 2.9020706668111034E-3 | D21: =R[-1]C*'[age-dist(GBR_uk-office-of-national-statistics_ONS).csv]age-dist(GBR_uk-office-of-natio'!R20C6 -> 3.1093614287261814E-3 | E21: =R[-1]C*'[age-dist(GBR_uk-office-of-national-statistics_ONS).csv]age-dist(GBR_uk-office-of-natio'!R20C6 -> 4.3531060002166546E-3 | F21: =R[-1]C*'[age-dist(GBR_uk-office-of-national-statistics_ONS).csv]age-dist(GBR_uk-office-of-natio'!R20C6 -> 2.0729076191507876E-3 | G21: =R[-1]C*'[age-dist(GBR_uk-office-of-national-statistics_ONS).csv]age-dist(GBR_uk-office-of-natio'!R20C6 -> 4.9749782859618901E-3 | H21: =R[-1]C*'[age-dist(GBR_uk-office-of-national-statistics_ONS).csv]age-dist(GBR_uk-office-of-natio'!R20C6 -> 3.5239429525563393E-3 | I21: =R[-1]C*'[age-dist(GBR_uk-office-of-national-statistics_ONS).csv]age-dist(GBR_uk-office-of-natio'!R20C6 -> 3.1093614287261814E-3 | J21: =R[-1]C*'[age-dist(GBR_uk-office-of-national-statistics_ONS).csv]age-dist(GBR_uk-office-of-natio'!R20C6 -> 8.498921238518229E-3 | K21: =R[-1]C*'[age-dist(GBR_uk-office-of-national-statistics_ONS).csv]age-dist(GBR_uk-office-of-natio'!R20C6 -> 1.0364538095753939E-2 | L21: =R[-1]C*'[age-dist(GBR_uk-office-of-national-statistics_ONS).csv]age-dist(GBR_uk-office-of-natio'!R20C6 -> 1.4717644095970589E-2 | M21: =R[-1]C*'[age-dist(GBR_uk-office-of-national-statistics_ONS).csv]age-dist(GBR_uk-office-of-natio'!R20C6 -> 1.0986410381499176E-2 | N21: =R[-1]C*'[age-dist(GBR_uk-office-of-national-statistics_ONS).csv]age-dist(GBR_uk-office-of-natio'!R20C6 -> 1.5754097905545984E-2 | O21: =R[-1]C*'[age-dist(GBR_uk-office-of-national-statistics_ONS).csv]age-dist(GBR_uk-office-of-natio'!R20C6 -> 9.7426658100087018E-3 | P21: =R[-1]C*'[age-dist(GBR_uk-office-of-national-statistics_ONS).csv]age-dist(GBR_uk-office-of-natio'!R20C6 -> 1.533951638171583E-2 | Q21: =R[-1]C*'[age-dist(GBR_uk-office-of-national-statistics_ONS).csv]age-dist(GBR_uk-office-of-natio'!R20C6 -> 3.0471742001516578E-2 | R21: =R[-1]C*'[age-dist(GBR_uk-office-of-national-statistics_ONS).csv]age-dist(GBR_uk-office-of-natio'!R20C6 -> 2.1303812493144846E-2 | S21: =R[-1]C*'[age-dist(GBR_uk-office-of-national-statistics_ONS).csv]age-dist(GBR_uk-office-of-natio'!R20C6 -> 1.1005635284378817E-2 | T21: =R[-1]C*'[age-dist(GBR_uk-office-of-national-statistics_ONS).csv]age-dist(GBR_uk-office-of-natio'!R20C6 -> 3.4575373604348921E-3 | U21: =R[-1]C*'[age-dist(GBR_uk-office-of-national-statistics_ONS).csv]age-dist(GBR_uk-office-of-natio'!R20C6 -> 6.3165106163740785E-4
C25: =SUM(R[-22]C:R[-4]C) -> 9.0472306449591837 | D25: =SUM(R[-22]C:R[-4]C) -> 14.769175691027698 | E25: =SUM(R[-22]C:R[-4]C) -> 15.050845967438773 | F25: =SUM(R[-22]C:R[-4]C) -> 15.569450460685127 | G25: =SUM(R[-22]C:R[-4]C) -> 11.876681105644312 | H25: =SUM(R[-22]C:R[-4]C) -> 12.103065783164721 | I25: =SUM(R[-22]C:R[-4]C) -> 10.969175691027695 | J25: =SUM(R[-22]C:R[-4]C) -> 12.029746888809036 | K25: =SUM(R[-22]C:R[-4]C) -> 12.567252303425654 | L25: =SUM(R[-22]C:R[-4]C) -> 12.788098270864429 | M25: =SUM(R[-22]C:R[-4]C) -> 10.033087441631192 | N25: =SUM(R[-22]C:R[-4]C) -> 10.36782350120699 | O25: =SUM(R[-22]C:R[-4]C) -> 9.1814171652201146 | P25: =SUM(R[-22]C:R[-4]C) -> 10.313933409069964 | Q25: =SUM(R[-22]C:R[-4]C) -> 9.0859217720714192 | R25: =SUM(R[-22]C:R[-4]C) -> 6.3522713519285556 | S25: =SUM(R[-22]C:R[-4]C) -> 3.2816089490662561 | T25: =SUM(R[-22]C:R[-4]C) -> 1.030952348551724 | U25: =SUM(R[-22]C:R[-4]C) -> 0.18834276468334868 | W25: =AVERAGE(RC[-20]:RC[-2]) -> 9.8213727110776947
C26: =(R[-1]C-R25C23)/R25C23 -> -7.8822185950172E-2 | D26: =(R[-1]C-R25C23)/R25C23 -> 0.50377916870716977 | E26: =(R[-1]C-R25C23)/R25C23 -> 0.53245848724004397 | F26: =(R[-1]C-R25C23)/R25C23 -> 0.58526215415122951 | G26: =(R[-1]C-R25C23)/R25C23 -> 0.2092689540483888 | H26: =(R[-1]C-R25C23)/R25C23 -> 0.23231916140535691 | I26: =(R[-1]C-R25C23)/R25C23 -> 0.11686787720166388 | J26: =(R[-1]C-R25C23)/R25C23 -> 0.22485392242985328 | K26: =(R[-1]C-R25C23)/R25C23 -> 0.27958205773525274 | L26: =(R[-1]C-R25C23)/R25C23 -> 0.30206832049459992 | M26: =(R[-1]C-R25C23)/R25C23 -> 2.1556531533998374E-2 | N26: =(R[-1]C-R25C23)/R25C23 -> 5.5638942356086761E-2 | O26: =(R[-1]C-R25C23)/R25C23 -> -6.5159480724701874E-2 | P26: =(R[-1]C-R25C23)/R25C23 -> 5.0151919948695334E-2 | Q26: =(R[-1]C-R25C23)/R25C23 -> -7.4882703328909186E-2 | R26: =(R[-1]C-R25C23)/R25C23 -> -0.35321960190313112 | S26: =(R[-1]C-R25C23)/R25C23 -> -0.66587064297388154 | T26: =(R[-1]C-R25C23)/R25C23 -> -0.89502970930032066 | U26: =(R[-1]C-R25C23)/R25C23 -> -0.98082317307122324

Sheet: ITA
C1: age group of participant
A2: age of contact | C2: 0 | D2: 5 | E2: 10 | F2: 15 | G2: 20 | H2: 25 | I2: 30 | J2: 35 | K2: 40 | L2: 45 | M2: 50 | N2: 55 | O2: 60 | P2: 65 | Q2: 70
B3: 0 | C3: 4.68 | D3: 1.04 | E3: 0.2 | F3: 0.11 | G3: 0.57999999999999996 | H3: 0.11 | I3: 0.88 | J3: 0.88 | K3: 0.75 | L3: 1.08 | M3: 0.17 | N3: 0.43 | O3: 0.43 | P3: 0.25 | Q3: 0.23
B4: 5 | C4: 1.64 | D4: 9.23 | E4: 1.25 | F4: 0.24 | G4: 0.19 | H4: 0.24 | I4: 0.86 | J4: 0.95 | K4: 1 | L4: 0.92 | M4: 1.07 | N4: 1.1200000000000001 | O4: 0.28000000000000003 | P4: 0.32 | Q4: 0.33
B5: 10 | C5: 0.4 | D5: 1.84 | E5: 14.56 | F5: 1.26 | G5: 0.43 | H5: 0.34 | I5: 0.36 | J5: 0.39 | K5: 0.92 | L5: 0.67 | M5: 3.15 | N5: 1.31 | O5: 1.34 | P5: 0.18 | Q5: 1.43
B6: 15 | C6: 0.19 | D6: 0.23 | E6: 2.59 | F6: 17.53 | G6: 1.0900000000000001 | H6: 0.82 | I6: 0.56000000000000005 | J6: 0.7 | K6: 1.31 | L6: 2.2200000000000002 | M6: 2.52 | N6: 0.43 | O6: 0.83 | P6: 0.14000000000000001 | Q6: 0.97
B7: 20 | C7: 0.24 | D7: 0.35 | E7: 0.65 | F7: 1.6 | G7: 4.96 | H7: 3.42 | I7: 0.88 | J7: 0.75 | K7: 1.19 | L7: 0.67 | M7: 0.74 | N7: 0.8 | O7: 0.64 | P7: 0.21 | Q7: 0.37
B8: 25 | C8: 0.62 | D8: 0.54 | E8: 0.46 | F8: 0.87 | G8: 3.04 | H8: 3.45 | I8: 1.66 | J8: 1.52 | K8: 1.1399999999999999 | L8: 1 | M8: 1.24 | N8: 1.18 | O8: 1.1499999999999999 | P8: 0.61 | Q8: 1.1000000000000001
B9: 30 | C9: 0.97 | D9: 0.77 | E9: 0.52 | F9: 0.53 | G9: 1.4 | H9: 2.97 | I9: 2.54 | J9: 2.3199999999999998 | K9: 1.95 | L9: 1.77 | M9: 1.02 | N9: 1.18 | O9: 1.45 | P9: 1.1399999999999999 | Q9: 0.93
B10: 35 | C10: 1.29 | D10: 1.35 | E10: 0.95 | F10: 0.67 | G10: 1.17 | H10: 1.55 | I10: 2.42 | J10: 3.09 | K10: 2.0499999999999998 | L10: 1.75 | M10: 1.5 | N10: 1.31 | O10: 1.49 | P10: 1.18 | Q10: 0.56999999999999995
B11: 40 | C11: 1.28 | D11: 1.62 | E11: 1.72 | F11: 1.24 | G11: 1.1100000000000001 | H11: 1.24 | I11: 1.6 | J11: 3.18 | K11: 3.1 | L11: 1.83 | M11: 1.72 | N11: 1.65 | O11: 1.3 | P11: 0.89 | Q11: 0.97
B12: 45 | C12: 0.73 | D12: 0.66 | E12: 1.4 | F12: 2.0099999999999998 | G12: 1.58 | H12: 1.08 | I12: 1.02 | J12: 1.61 | K12: 1.97 | L12: 1.58 | M12: 1.57 | N12: 1.41 | O12: 1.55 | P12: 1 | Q12: 1
B13: 50 | C13: 0.51 | D13: 0.56000000000000005 | E13: 0.84 | F13: 1.21 | G13: 1.42 | H13: 1 | I13: 1.1000000000000001 | J13: 1.1599999999999999 | K13: 2.02 | L13: 1.63 | M13: 1.63 | N13: 1.39 | O13: 1.32 | P13: 0.89 | Q13: 0.77
B14: 55 | C14: 0.64 | D14: 0.43 | E14: 0.42 | F14: 0.54 | G14: 0.89 | H14: 0.92 | I14: 0.8 | J14: 0.82 | K14: 0.73 | L14: 1.07 | M14: 1.69 | N14: 1.84 | O14: 1.53 | P14: 0.71 | Q14: 1.03
B15: 60 | C15: 0.47 | D15: 0.41 | E15: 0.18 | F15: 0.26 | G15: 0.62 | H15: 0.53 | I15: 0.8 | J15: 0.84 | K15: 0.98 | L15: 0.55000000000000004 | M15: 0.72 | N15: 1.31 | O15: 0.94 | P15: 1.18 | Q15: 0.73
B16: 65 | C16: 0.53 | D16: 0.45 | E16: 0.37 | F16: 0.04 | G16: 0.21 | H16: 0.26 | I16: 0.57999999999999996 | J16: 0.7 | K16: 0.51 | L16: 0.25 | M16: 0.26 | N16: 0.84 | O16: 1.1100000000000001 | P16: 1.21 | Q16: 1.27
B17: 70 | C17: 0.83 | D17: 0.83 | E17: 0.71 | F17: 0.39 | G17: 0.6 | H17: 0.79 | I17: 0.56000000000000005 | J17: 0.88 | K17: 1.07 | L17: 0.9 | M17: 0.96 | N17: 1.57 | O17: 1.7 | P17: 1.39 | Q17: 1.27

Sheet: LUX
C1: age group of participant
A2: age of contact | C2: 0 | D2: 5 | E2: 10 | F2: 15 | G2: 20 | H2: 25 | I2: 30 | J2: 35 | K2: 40 | L2: 45 | M2: 50 | N2: 55 | O2: 60 | P2: 65 | Q2: 70
B3: 0 | C3: 2.34 | D3: 0.88 | E3: 0.21 | F3: 0.19 | G3: 0.11 | H3: 0.76 | I3: 1.48 | J3: 0.72 | K3: 0.79 | L3: 0.61 | M3: 0.27 | N3: 0.47 | O3: 0.52 | P3: 0.24 | Q3: 0.05
B4: 5 | C4: 1.05 | D4: 8.76 | E4: 1.71 | F4: 0.25 | G4: 0.22 | H4: 1.24 | I4: 2.2400000000000002 | J4: 1.0900000000000001 | K4: 1.1599999999999999 | L4: 0.28000000000000003 | M4: 1.02 | N4: 0.44 | O4: 0.35 | P4: 0.17 | Q4: 0.2
B5: 10 | C5: 0.48 | D5: 1.76 | E5: 11.65 | F5: 1.64 | G5: 0.43 | H5: 0.96 | I5: 1.24 | J5: 0.62 | K5: 1.53 | L5: 0.66 | M5: 0.54 | N5: 0.16 | O5: 0.15 | P5: 7.0000000000000007E-2 | Q5: 0.18
B6: 15 | C6: 0.18 | D6: 0.52 | E6: 2.3199999999999998 | F6: 11.78 | G6: 2.89 | H6: 1.45 | I6: 0.7 | J6: 0.36 | K6: 1.38 | L6: 1.87 | M6: 0.46 | N6: 1.44 | O6: 0.28000000000000003 | P6: 0.1 | Q6: 0.18
B7: 20 | C7: 0.35 | D7: 0.24 | E7: 0.37 | F7: 2.13 | G7: 3.78 | H7: 1.8 | I7: 0.85 | J7: 0.64 | K7: 0.66 | L7: 1.34 | M7: 0.79 | N7: 0.56999999999999995 | O7: 0.52 | P7: 0.31 | Q7: 0.13
B8: 25 | C8: 0.79 | D8: 0.78 | E8: 0.36 | F8: 0.92 | G8: 2.31 | H8: 3.08 | I8: 2.48 | J8: 1.1399999999999999 | K8: 1.44 | L8: 1.3 | M8: 1.52 | N8: 1.25 | O8: 0.91 | P8: 0.69 | Q8: 0.33
B9: 30 | C9: 1.3 | D9: 0.94 | E9: 0.66 | F9: 0.78 | G9: 1.48 | H9: 2.17 | I9: 3.48 | J9: 1.72 | K9: 2.56 | L9: 1.81 | M9: 1.65 | N9: 1.29 | O9: 1.4 | P9: 1.03 | Q9: 0.45
B10: 35 | C10: 1.45 | D10: 1.79 | E10: 1.1399999999999999 | F10: 0.94 | G10: 1.41 | H10: 1.9 | I10: 3.11 | J10: 2.59 | K10: 2.72 | L10: 1.75 | M10: 1.63 | N10: 1.03 | O10: 1.28 | P10: 1.41 | Q10: 0.5
B11: 40 | C11: 0.83 | D11: 1.29 | E11: 1.6 | F11: 1.36 | G11: 1.19 | H11: 1.41 | I11: 2.48 | J11: 2.36 | K11: 3.54 | L11: 1.63 | M11: 1.9 | N11: 1.0900000000000001 | O11: 1.1399999999999999 | P11: 1.17 | Q11: 0.65
B12: 45 | C12: 0.37 | D12: 0.56999999999999995 | E12: 1.02 | F12: 1.36 | G12: 1.67 | H12: 1.1100000000000001 | I12: 1.48 | J12: 1.84 | K12: 2.37 | L12: 2.46 | M12: 1.97 | N12: 1.04 | O12: 0.8 | P12: 0.69 | Q12: 0.43
B13: 50 | C13: 0.33 | D13: 0.37 | E13: 0.43 | F13: 0.69 | G13: 1.28 | H13: 1.38 | I13: 1.24 | J13: 1 | K13: 1.37 | L13: 2.0299999999999998 | M13: 2.13 | N13: 1.06 | O13: 0.94 | P13: 0.93 | Q13: 0.35
B14: 55 | C14: 0.33 | D14: 0.33 | E14: 0.31 | F14: 0.4 | G14: 0.52 | H14: 1.06 | I14: 0.78 | J14: 0.74 | K14: 0.62 | L14: 0.78 | M14: 1.19 | N14: 1.0900000000000001 | O14: 0.95 | P14: 1.07 | Q14: 0.38
B15: 60 | C15: 0.4 | D15: 0.24 | E15: 0.16 | F15: 0.13 | G15: 0.24 | H15: 0.54 | I15: 0.28000000000000003 | J15: 0.62 | K15: 0.46 | L15: 0.46 | M15: 0.67 | N15: 0.65 | O15: 1.1200000000000001 | P15: 1.07 | Q15: 0.6
B16: 65 | C16: 0.23 | D16: 0.12 | E16: 0.21 | F16: 0.1 | G16: 0.2 | H16: 0.27 | I16: 0.41 | J16: 0.31 | K16: 0.5 | L16: 0.36 | M16: 0.33 | N16: 0.43 | O16: 0.8 | P16: 1.17 | Q16: 0.57999999999999996
B17: 70 | C17: 0.28000000000000003 | D17: 0.27 | E17: 0.28999999999999998 | F17: 0.28000000000000003 | G17: 0.43 | H17: 0.57999999999999996 | I17: 0.48 | J17: 0.26 | K17: 0.72 | L17: 0.93 | M17: 1.4 | N17: 0.64 | O17: 1.1100000000000001 | P17: 0.93 | Q17: 1.75

Sheet: NLD
C1: age group of participant
A2: age of contact | C2: 0 | D2: 5 | E2: 10 | F2: 15 | G2: 20 | H2: 25 | I2: 30 | J2: 35 | K2: 40 | L2: 45 | M2: 50 | N2: 55 | O2: 60 | P2: 65 | Q2: 70
B3: 0 | C3: 3.5 | D3: 1.71 | E3: 0.25 | F3: 0.19 | G3: 0.33 | H3: 0.56999999999999995 | I3: 1 | J3: 0.92 | K3: 3 | L3: 0 | M3: 0 | N3: 0.23 | O3: 0.39 | P3: 0.12 | Q3: 0.22
B4: 5 | C4: 2.4700000000000002 | D4: 11.88 | E4: 1.56 | F4: 0.19 | G4: 0 | H4: 0.5 | I4: 1.25 | J4: 1.62 | K4: 1.1399999999999999 | L4: 0.71 | M4: 0.31 | N4: 0.08 | O4: 0.28000000000000003 | P4: 0.24 | Q4: 0.28999999999999998
B5: 10 | C5: 0.32 | D5: 1.06 | E5: 10.97 | F5: 2.5 | G5: 0.08 | H5: 0 | I5: 1.5 | J5: 1 | K5: 0.71 | L5: 0.93 | M5: 0.08 | N5: 0.31 | O5: 0.22 | P5: 0.06 | Q5: 0.2
B6: 15 | C6: 0.15 | D6: 0.24 | E6: 1.44 | F6: 9.19 | G6: 0.83 | H6: 0.28999999999999998 | I6: 1.25 | J6: 0.08 | K6: 0.56999999999999995 | L6: 0.79 | M6: 0.46 | N6: 0.46 | O6: 0.39 | P6: 0 | Q6: 0.24
B7: 20 | C7: 0.24 | D7: 0.18 | E7: 0.16 | F7: 1.25 | G7: 2.42 | H7: 0.56999999999999995 | I7: 0.75 | J7: 0.85 | K7: 2.29 | L7: 0.71 | M7: 2.23 | N7: 0.85 | O7: 0.5 | P7: 0.28999999999999998 | Q7: 0.28999999999999998
B8: 25 | C8: 0.21 | D8: 0.88 | E8: 0.13 | F8: 0.44 | G8: 1.58 | H8: 1.86 | I8: 2.25 | J8: 0.62 | K8: 0.86 | L8: 1.21 | M8: 1.85 | N8: 0.38 | O8: 0.56000000000000005 | P8: 0.41 | Q8: 0.32
B9: 30 | C9: 1.26 | D9: 0.71 | E9: 0.25 | F9: 0.44 | G9: 2.67 | H9: 1 | I9: 3.75 | J9: 1 | K9: 1.71 | L9: 0.86 | M9: 0.85 | N9: 0.92 | O9: 0.94 | P9: 0.18 | Q9: 0.49
B10: 35 | C10: 1.1499999999999999 | D10: 1.53 | E10: 0.78 | F10: 0.75 | G10: 1.58 | H10: 0.86 | I10: 3 | J10: 3.92 | K10: 1.29 | L10: 1.79 | M10: 1.23 | N10: 0.69 | O10: 1.17 | P10: 0.59 | Q10: 0.71
B11: 40 | C11: 0.53 | D11: 1.76 | E11: 1.56 | F11: 0.69 | G11: 0.67 | H11: 1.07 | I11: 2.13 | J11: 3.08 | K11: 1.86 | L11: 2.5 | M11: 0.38 | N11: 1.54 | O11: 0.78 | P11: 0.65 | Q11: 0.71
B12: 45 | C12: 0.24 | D12: 0.47 | E12: 0.94 | F12: 1.38 | G12: 0.92 | H12: 0.5 | I12: 1.63 | J12: 1.69 | K12: 1.29 | L12: 2.21 | M12: 1.23 | N12: 1 | O12: 0.61 | P12: 0.35 | Q12: 1.24
B13: 50 | C13: 0.47 | D13: 0.47 | E13: 0.56000000000000005 | F13: 0.69 | G13: 0.83 | H13: 1.21 | I13: 0.88 | J13: 1.62 | K13: 1.1399999999999999 | L13: 1.5 | M13: 1.31 | N13: 1.23 | O13: 1.17 | P13: 0.24 | Q13: 0.51
B14: 55 | C14: 0.38 | D14: 0.24 | E14: 0.19 | F14: 0.31 | G14: 0.25 | H14: 0.56999999999999995 | I14: 0.25 | J14: 0.46 | K14: 0 | L14: 0.93 | M14: 0.69 | N14: 2.38 | O14: 1.67 | P14: 0.71 | Q14: 0.51
B15: 60 | C15: 0.35 | D15: 0.41 | E15: 0.03 | F15: 0.06 | G15: 0.08 | H15: 0.28999999999999998 | I15: 0.5 | J15: 0.92 | K15: 0.14000000000000001 | L15: 0.43 | M15: 0.38 | N15: 1.1499999999999999 | O15: 1.61 | P15: 1.1200000000000001 | Q15: 0.46
B16: 65 | C16: 0.28999999999999998 | D16: 0.28999999999999998 | E16: 0.13 | F16: 0.13 | G16: 0 | H16: 0.14000000000000001 | I16: 0.13 | J16: 0.69 | K16: 0.14000000000000001 | L16: 0 | M16: 0.31 | N16: 0.69 | O16: 0.72 | P16: 0.82 | Q16: 0.46
B17: 70 | C17: 0.24 | D17: 0.24 | E17: 0.56000000000000005 | F17: 0.56000000000000005 | G17: 0.33 | H17: 0.21 | I17: 0.63 | J17: 0.46 | K17: 0 | L17: 0.79 | M17: 0.62 | N17: 0.23 | O17: 1.1100000000000001 | P17: 1 | Q17: 1.95

Sheet: POL
C1: age group of participant
A2: age of contact | C2: 0 | D2: 5 | E2: 10 | F2: 15 | G2: 20 | H2: 25 | I2: 30 | J2: 35 | K2: 40 | L2: 45 | M2: 50 | N2: 55 | O2: 60 | P2: 65 | Q2: 70
B3: 0 | C3: 1.33 | D3: 0.56999999999999995 | E3: 0.21 | F3: 0.1 | G3: 0.21 | H3: 0.4 | I3: 0.38 | J3: 0.23 | K3: 0.11 | L3: 0.13 | M3: 0.31 | N3: 0.23 | O3: 0.25 | P3: 0.2 | Q3: 0.23
B4: 5 | C4: 0.83 | D4: 6.41 | E4: 1.06 | F4: 0.28999999999999998 | G4: 0.1 | H4: 0.27 | I4: 0.74 | J4: 0.77 | K4: 0.56000000000000005 | L4: 0.16 | M4: 0.24 | N4: 0.5 | O4: 0.27 | P4: 0.44 | Q4: 0.26
B5: 10 | C5: 0.75 | D5: 1.62 | E5: 12.71 | F5: 1.01 | G5: 0.3 | H5: 0.25 | I5: 0.8 | J5: 0.68 | K5: 0.69 | L5: 0.26 | M5: 0.37 | N5: 0.42 | O5: 0.25 | P5: 0.44 | Q5: 0.34
B6: 15 | C6: 0.49 | D6: 0.41 | E6: 2.27 | F6: 12.12 | G6: 2.13 | H6: 0.72 | I6: 0.54 | J6: 1.29 | K6: 1.18 | L6: 1.1299999999999999 | M6: 0.94 | N6: 0.66 | O6: 0.53 | P6: 0.6 | Q6: 0.4
B7: 20 | C7: 0.69 | D7: 0.36 | E7: 0.63 | F7: 1.69 | G7: 6.26 | H7: 2.4 | I7: 1.1599999999999999 | J7: 1.4 | K7: 1.58 | L7: 1.44 | M7: 1.45 | N7: 1.02 | O7: 0.66 | P7: 0.6 | Q7: 0.34
B8: 25 | C8: 1.36 | D8: 0.92 | E8: 0.84 | F8: 0.8 | G8: 2.61 | H8: 3.43 | I8: 2.2799999999999998 | J8: 2.5 | K8: 1.81 | L8: 1.75 | M8: 1.94 | N8: 1.37 | O8: 1.1000000000000001 | P8: 1.36 | Q8: 0.26
B9: 30 | C9: 1.19 | D9: 1.42 | E9: 1.19 | F9: 0.88 | G9: 1.59 | H9: 2.1800000000000002 | I9: 2.36 | J9: 2.68 | K9: 1.77 | L9: 1.44 | M9: 1.61 | N9: 1.34 | O9: 1.31 | P9: 1.4 | Q9: 0.46
B10: 35 | C10: 0.85 | D10: 0.96 | E10: 1.23 | F10: 1.06 | G10: 1.1299999999999999 | H10: 1.43 | I10: 1.64 | J10: 3.08 | K10: 1.76 | L10: 1.33 | M10: 1.24 | N10: 1.06 | O10: 1.02 | P10: 1.08 | Q10: 0.71
B11: 40 | C11: 0.44 | D11: 0.68 | E11: 0.96 | F11: 1.17 | G11: 1.1100000000000001 | H11: 1.37 | I11: 1.44 | J11: 1.87 | K11: 2.4700000000000002 | L11: 1.49 | M11: 1.71 | N11: 0.98 | O11: 1.07 | P11: 1.68 | Q11: 0.74
B12: 45 | C12: 0.47 | D12: 0.59 | E12: 0.71 | F12: 0.96 | G12: 0.98 | H12: 1.1200000000000001 | I12: 1.36 | J12: 1.52 | K12: 1.56 | L12: 2.25 | M12: 1.74 | N12: 1.1599999999999999 | O12: 0.56000000000000005 | P12: 0.92 | Q12: 0.83
B13: 50 | C13: 0.56999999999999995 | D13: 0.47 | E13: 0.46 | F13: 0.51 | G13: 1.2 | H13: 1.33 | I13: 1.1100000000000001 | J13: 1.05 | K13: 1.03 | L13: 1.56 | M13: 1.58 | N13: 1.4 | O13: 0.56000000000000005 | P13: 0.96 | Q13: 0.74
B14: 55 | C14: 0.53 | D14: 0.48 | E14: 0.28000000000000003 | F14: 0.25 | G14: 0.79 | H14: 0.77 | I14: 0.56000000000000005 | J14: 0.87 | K14: 0.68 | L14: 0.61 | M14: 0.94 | N14: 1.95 | O14: 1.1000000000000001 | P14: 0.68 | Q14: 0.54
B15: 60 | C15: 0.28999999999999998 | D15: 0.32 | E15: 0.24 | F15: 0.25 | G15: 0.34 | H15: 0.45 | I15: 0.59 | J15: 0.57999999999999996 | K15: 0.56000000000000005 | L15: 0.41 | M15: 0.52 | N15: 0.84 | O15: 1.1200000000000001 | P15: 0.48 | Q15: 0.56999999999999995
B16: 65 | C16: 0.26 | D16: 0.18 | E16: 0.15 | F16: 0.2 | G16: 0.1 | H16: 0.23 | I16: 0.18 | J16: 0.53 | K16: 0.34 | L16: 0.31 | M16: 0.19 | N16: 0.56000000000000005 | O16: 0.64 | P16: 0.72 | Q16: 0.54
B17: 70 | C17: 0.28000000000000003 | D17: 0.36 | E17: 0.38 | F17: 0.23 | G17: 0.3 | H17: 0.4 | I17: 0.3 | J17: 0.71 | K17: 0.55000000000000004 | L17: 0.67 | M17: 0.71 | N17: 0.77 | O17: 0.64 | P17: 0.8 | Q17: 1.23

Sheet: pooled_norm
A1: 0 | B1: 5 | C1: 10 | D1: 15 | E1: 20 | F1: 25 | G1: 30 | H1: 35 | I1: 40 | J1: 45 | K1: 50 | L1: 55 | M1: 60 | N1: 65 | O1: 70
A2: =AVERAGE(BEL!R[1]C[2],DEU!R[1]C[2],FIN!R[1]C[2],GBR!R[1]C[2],ITA!R[1]C[2],LUX!R[1]C[2],NLD!R[1]C[2],POL!R[1]C[2])*100 -> 237.5 | B2: =AVERAGE(BEL!R[1]C[2],DEU!R[1]C[2],FIN!R[1]C[2],GBR!R[1]C[2],ITA!R[1]C[2],LUX!R[1]C[2],NLD!R[1]C[2],POL!R[1]C[2])*100 -> 89.875 | C2: =AVERAGE(BEL!R[1]C[2],DEU!R[1]C[2],FIN!R[1]C[2],GBR!R[1]C[2],ITA!R[1]C[2],LUX!R[1]C[2],NLD!R[1]C[2],POL!R[1]C[2])*100 -> 27 | D2: =AVERAGE(BEL!R[1]C[2],DEU!R[1]C[2],FIN!R[1]C[2],GBR!R[1]C[2],ITA!R[1]C[2],LUX!R[1]C[2],NLD!R[1]C[2],POL!R[1]C[2])*100 -> 18.125 | E2: =AVERAGE(BEL!R[1]C[2],DEU!R[1]C[2],FIN!R[1]C[2],GBR!R[1]C[2],ITA!R[1]C[2],LUX!R[1]C[2],NLD!R[1]C[2],POL!R[1]C[2])*100 -> 27 | F2: =AVERAGE(BEL!R[1]C[2],DEU!R[1]C[2],FIN!R[1]C[2],GBR!R[1]C[2],ITA!R[1]C[2],LUX!R[1]C[2],NLD!R[1]C[2],POL!R[1]C[2])*100 -> 50.374999999999993 | G2: =AVERAGE(BEL!R[1]C[2],DEU!R[1]C[2],FIN!R[1]C[2],GBR!R[1]C[2],ITA!R[1]C[2],LUX!R[1]C[2],NLD!R[1]C[2],POL!R[1]C[2])*100 -> 82.375 | H2: =AVERAGE(BEL!R[1]C[2],DEU!R[1]C[2],FIN!R[1]C[2],GBR!R[1]C[2],ITA!R[1]C[2],LUX!R[1]C[2],NLD!R[1]C[2],POL!R[1]C[2])*100 -> 65.625 | I2: =AVERAGE(BEL!R[1]C[2],DEU!R[1]C[2],FIN!R[1]C[2],GBR!R[1]C[2],ITA!R[1]C[2],LUX!R[1]C[2],NLD!R[1]C[2],POL!R[1]C[2])*100 -> 68.375000000000014 | J2: =AVERAGE(BEL!R[1]C[2],DEU!R[1]C[2],FIN!R[1]C[2],GBR!R[1]C[2],ITA!R[1]C[2],LUX!R[1]C[2],NLD!R[1]C[2],POL!R[1]C[2])*100 -> 32.25 | K2: =AVERAGE(BEL!R[1]C[2],DEU!R[1]C[2],FIN!R[1]C[2],GBR!R[1]C[2],ITA!R[1]C[2],LUX!R[1]C[2],NLD!R[1]C[2],POL!R[1]C[2])*100 -> 24.25 | L2: =AVERAGE(BEL!R[1]C[2],DEU!R[1]C[2],FIN!R[1]C[2],GBR!R[1]C[2],ITA!R[1]C[2],LUX!R[1]C[2],NLD!R[1]C[2],POL!R[1]C[2])*100 -> 27.750000000000004 | M2: =AVERAGE(BEL!R[1]C[2],DEU!R[1]C[2],FIN!R[1]C[2],GBR!R[1]C[2],ITA!R[1]C[2],LUX!R[1]C[2],NLD!R[1]C[2],POL!R[1]C[2])*100 -> 32.875 | N2: =AVERAGE(BEL!R[1]C[2],DEU!R[1]C[2],FIN!R[1]C[2],GBR!R[1]C[2],ITA!R[1]C[2],LUX!R[1]C[2],NLD!R[1]C[2],POL!R[1]C[2])*100 -> 18.749999999999996 | O2: =AVERAGE(BEL!R[1]C[2],DEU!R[1]C[2],FIN!R[1]C[2],GBR!R[1]C[2],ITA!R[1]C[2],LUX!R[1]C[2],NLD!R[1]C[2],POL!R[1]C[2])*100 -> 15.875
A3: =AVERAGE(BEL!R[1]C[2],DEU!R[1]C[2],FIN!R[1]C[2],GBR!R[1]C[2],ITA!R[1]C[2],LUX!R[1]C[2],NLD!R[1]C[2],POL!R[1]C[2])*100 -> 119.75 | B3: =AVERAGE(BEL!R[1]C[2],DEU!R[1]C[2],FIN!R[1]C[2],GBR!R[1]C[2],ITA!R[1]C[2],LUX!R[1]C[2],NLD!R[1]C[2],POL!R[1]C[2])*100 -> 665.625 | C3: =AVERAGE(BEL!R[1]C[2],DEU!R[1]C[2],FIN!R[1]C[2],GBR!R[1]C[2],ITA!R[1]C[2],LUX!R[1]C[2],NLD!R[1]C[2],POL!R[1]C[2])*100 -> 112.75 | D3: =AVERAGE(BEL!R[1]C[2],DEU!R[1]C[2],FIN!R[1]C[2],GBR!R[1]C[2],ITA!R[1]C[2],LUX!R[1]C[2],NLD!R[1]C[2],POL!R[1]C[2])*100 -> 36.500000000000007 | E3: =AVERAGE(BEL!R[1]C[2],DEU!R[1]C[2],FIN!R[1]C[2],GBR!R[1]C[2],ITA!R[1]C[2],LUX!R[1]C[2],NLD!R[1]C[2],POL!R[1]C[2])*100 -> 21.875 | F3: =AVERAGE(BEL!R[1]C[2],DEU!R[1]C[2],FIN!R[1]C[2],GBR!R[1]C[2],ITA!R[1]C[2],LUX!R[1]C[2],NLD!R[1]C[2],POL!R[1]C[2])*100 -> 45.375 | G3: =AVERAGE(BEL!R[1]C[2],DEU!R[1]C[2],FIN!R[1]C[2],GBR!R[1]C[2],ITA!R[1]C[2],LUX!R[1]C[2],NLD!R[1]C[2],POL!R[1]C[2])*100 -> 92.625 | H3: =AVERAGE(BEL!R[1]C[2],DEU!R[1]C[2],FIN!R[1]C[2],GBR!R[1]C[2],ITA!R[1]C[2],LUX!R[1]C[2],NLD!R[1]C[2],POL!R[1]C[2])*100 -> 97.125 | I3: =AVERAGE(BEL!R[1]C[2],DEU!R[1]C[2],FIN!R[1]C[2],GBR!R[1]C[2],ITA!R[1]C[2],LUX!R[1]C[2],NLD!R[1]C[2],POL!R[1]C[2])*100 -> 70 | J3: =AVERAGE(BEL!R[1]C[2],DEU!R[1]C[2],FIN!R[1]C[2],GBR!R[1]C[2],ITA!R[1]C[2],LUX!R[1]C[2],NLD!R[1]C[2],POL!R[1]C[2])*100 -> 34.625000000000007 | K3: =AVERAGE(BEL!R[1]C[2],DEU!R[1]C[2],FIN!R[1]C[2],GBR!R[1]C[2],ITA!R[1]C[2],LUX!R[1]C[2],NLD!R[1]C[2],POL!R[1]C[2])*100 -> 46.875 | L3: =AVERAGE(BEL!R[1]C[2],DEU!R[1]C[2],FIN!R[1]C[2],GBR!R[1]C[2],ITA!R[1]C[2],LUX!R[1]C[2],NLD!R[1]C[2],POL!R[1]C[2])*100 -> 35.25 | M3: =AVERAGE(BEL!R[1]C[2],DEU!R[1]C[2],FIN!R[1]C[2],GBR!R[1]C[2],ITA!R[1]C[2],LUX!R[1]C[2],NLD!R[1]C[2],POL!R[1]C[2])*100 -> 25.875000000000004 | N3: =AVERAGE(BEL!R[1]C[2],DEU!R[1]C[2],FIN!R[1]C[2],GBR!R[1]C[2],ITA!R[1]C[2],LUX!R[1]C[2],NLD!R[1]C[2],POL!R[1]C[2])*100 -> 31.5 | O3: =AVERAGE(BEL!R[1]C[2],DEU!R[1]C[2],FIN!R[1]C[2],GBR!R[1]C[2],ITA!R[1]C[2],LUX!R[1]C[2],NLD!R[1]C[2],POL!R[1]C[2])*100 -> 21.75
A4: =AVERAGE(BEL!R[1]C[2],DEU!R[1]C[2],FIN!R[1]C[2],GBR!R[1]C[2],ITA!R[1]C[2],LUX!R[1]C[2],NLD!R[1]C[2],POL!R[1]C[2])*100 -> 44.875 | B4: =AVERAGE(BEL!R[1]C[2],DEU!R[1]C[2],FIN!R[1]C[2],GBR!R[1]C[2],ITA!R[1]C[2],LUX!R[1]C[2],NLD!R[1]C[2],POL!R[1]C[2])*100 -> 131.625 | C4: =AVERAGE(BEL!R[1]C[2],DEU!R[1]C[2],FIN!R[1]C[2],GBR!R[1]C[2],ITA!R[1]C[2],LUX!R[1]C[2],NLD!R[1]C[2],POL!R[1]C[2])*100 -> 930.00000000000011 | D4: =AVERAGE(BEL!R[1]C[2],DEU!R[1]C[2],FIN!R[1]C[2],GBR!R[1]C[2],ITA!R[1]C[2],LUX!R[1]C[2],NLD!R[1]C[2],POL!R[1]C[2])*100 -> 137.24999999999997 | E4: =AVERAGE(BEL!R[1]C[2],DEU!R[1]C[2],FIN!R[1]C[2],GBR!R[1]C[2],ITA!R[1]C[2],LUX!R[1]C[2],NLD!R[1]C[2],POL!R[1]C[2])*100 -> 28.749999999999996 | F4: =AVERAGE(BEL!R[1]C[2],DEU!R[1]C[2],FIN!R[1]C[2],GBR!R[1]C[2],ITA!R[1]C[2],LUX!R[1]C[2],NLD!R[1]C[2],POL!R[1]C[2])*100 -> 26.75 | G4: =AVERAGE(BEL!R[1]C[2],DEU!R[1]C[2],FIN!R[1]C[2],GBR!R[1]C[2],ITA!R[1]C[2],LUX!R[1]C[2],NLD!R[1]C[2],POL!R[1]C[2])*100 -> 65.999999999999986 | H4: =AVERAGE(BEL!R[1]C[2],DEU!R[1]C[2],FIN!R[1]C[2],GBR!R[1]C[2],ITA!R[1]C[2],LUX!R[1]C[2],NLD!R[1]C[2],POL!R[1]C[2])*100 -> 75.125 | I4: =AVERAGE(BEL!R[1]C[2],DEU!R[1]C[2],FIN!R[1]C[2],GBR!R[1]C[2],ITA!R[1]C[2],LUX!R[1]C[2],NLD!R[1]C[2],POL!R[1]C[2])*100 -> 91.125000000000014 | J4: =AVERAGE(BEL!R[1]C[2],DEU!R[1]C[2],FIN!R[1]C[2],GBR!R[1]C[2],ITA!R[1]C[2],LUX!R[1]C[2],NLD!R[1]C[2],POL!R[1]C[2])*100 -> 55.625 | K4: =AVERAGE(BEL!R[1]C[2],DEU!R[1]C[2],FIN!R[1]C[2],GBR!R[1]C[2],ITA!R[1]C[2],LUX!R[1]C[2],NLD!R[1]C[2],POL!R[1]C[2])*100 -> 64.125 | L4: =AVERAGE(BEL!R[1]C[2],DEU!R[1]C[2],FIN!R[1]C[2],GBR!R[1]C[2],ITA!R[1]C[2],LUX!R[1]C[2],NLD!R[1]C[2],POL!R[1]C[2])*100 -> 37.125 | M4: =AVERAGE(BEL!R[1]C[2],DEU!R[1]C[2],FIN!R[1]C[2],GBR!R[1]C[2],ITA!R[1]C[2],LUX!R[1]C[2],NLD!R[1]C[2],POL!R[1]C[2])*100 -> 31.000000000000007 | N4: =AVERAGE(BEL!R[1]C[2],DEU!R[1]C[2],FIN!R[1]C[2],GBR!R[1]C[2],ITA!R[1]C[2],LUX!R[1]C[2],NLD!R[1]C[2],POL!R[1]C[2])*100 -> 22.125 | O4: =AVERAGE(BEL!R[1]C[2],DEU!R[1]C[2],FIN!R[1]C[2],GBR!R[1]C[2],ITA!R[1]C[2],LUX!R[1]C[2],NLD!R[1]C[2],POL!R[1]C[2])*100 -> 40
A5: =AVERAGE(BEL!R[1]C[2],DEU!R[1]C[2],FIN!R[1]C[2],GBR!R[1]C[2],ITA!R[1]C[2],LUX!R[1]C[2],NLD!R[1]C[2],POL!R[1]C[2])*100 -> 26.375 | B5: =AVERAGE(BEL!R[1]C[2],DEU!R[1]C[2],FIN!R[1]C[2],GBR!R[1]C[2],ITA!R[1]C[2],LUX!R[1]C[2],NLD!R[1]C[2],POL!R[1]C[2])*100 -> 33 | C5: =AVERAGE(BEL!R[1]C[2],DEU!R[1]C[2],FIN!R[1]C[2],GBR!R[1]C[2],ITA!R[1]C[2],LUX!R[1]C[2],NLD!R[1]C[2],POL!R[1]C[2])*100 -> 162 | D5: =AVERAGE(BEL!R[1]C[2],DEU!R[1]C[2],FIN!R[1]C[2],GBR!R[1]C[2],ITA!R[1]C[2],LUX!R[1]C[2],NLD!R[1]C[2],POL!R[1]C[2])*100 -> 905.875 | E5: =AVERAGE(BEL!R[1]C[2],DEU!R[1]C[2],FIN!R[1]C[2],GBR!R[1]C[2],ITA!R[1]C[2],LUX!R[1]C[2],NLD!R[1]C[2],POL!R[1]C[2])*100 -> 156.625 | F5: =AVERAGE(BEL!R[1]C[2],DEU!R[1]C[2],FIN!R[1]C[2],GBR!R[1]C[2],ITA!R[1]C[2],LUX!R[1]C[2],NLD!R[1]C[2],POL!R[1]C[2])*100 -> 62.374999999999993 | G5: =AVERAGE(BEL!R[1]C[2],DEU!R[1]C[2],FIN!R[1]C[2],GBR!R[1]C[2],ITA!R[1]C[2],LUX!R[1]C[2],NLD!R[1]C[2],POL!R[1]C[2])*100 -> 53.875000000000007 | H5: =AVERAGE(BEL!R[1]C[2],DEU!R[1]C[2],FIN!R[1]C[2],GBR!R[1]C[2],ITA!R[1]C[2],LUX!R[1]C[2],NLD!R[1]C[2],POL!R[1]C[2])*100 -> 53 | I5: =AVERAGE(BEL!R[1]C[2],DEU!R[1]C[2],FIN!R[1]C[2],GBR!R[1]C[2],ITA!R[1]C[2],LUX!R[1]C[2],NLD!R[1]C[2],POL!R[1]C[2])*100 -> 99.000000000000014 | J5: =AVERAGE(BEL!R[1]C[2],DEU!R[1]C[2],FIN!R[1]C[2],GBR!R[1]C[2],ITA!R[1]C[2],LUX!R[1]C[2],NLD!R[1]C[2],POL!R[1]C[2])*100 -> 122.50000000000001 | K5: =AVERAGE(BEL!R[1]C[2],DEU!R[1]C[2],FIN!R[1]C[2],GBR!R[1]C[2],ITA!R[1]C[2],LUX!R[1]C[2],NLD!R[1]C[2],POL!R[1]C[2])*100 -> 77.125 | L5: =AVERAGE(BEL!R[1]C[2],DEU!R[1]C[2],FIN!R[1]C[2],GBR!R[1]C[2],ITA!R[1]C[2],LUX!R[1]C[2],NLD!R[1]C[2],POL!R[1]C[2])*100 -> 49.875 | M5: =AVERAGE(BEL!R[1]C[2],DEU!R[1]C[2],FIN!R[1]C[2],GBR!R[1]C[2],ITA!R[1]C[2],LUX!R[1]C[2],NLD!R[1]C[2],POL!R[1]C[2])*100 -> 31.125000000000004 | N5: =AVERAGE(BEL!R[1]C[2],DEU!R[1]C[2],FIN!R[1]C[2],GBR!R[1]C[2],ITA!R[1]C[2],LUX!R[1]C[2],NLD!R[1]C[2],POL!R[1]C[2])*100 -> 20.625 | O5: =AVERAGE(BEL!R[1]C[2],DEU!R[1]C[2],FIN!R[1]C[2],GBR!R[1]C[2],ITA!R[1]C[2],LUX!R[1]C[2],NLD!R[1]C[2],POL!R[1]C[2])*100 -> 42.375
A6: =AVERAGE(BEL!R[1]C[2],DEU!R[1]C[2],FIN!R[1]C[2],GBR!R[1]C[2],ITA!R[1]C[2],LUX!R[1]C[2],NLD!R[1]C[2],POL!R[1]C[2])*100 -> 38.125 | B6: =AVERAGE(BEL!R[1]C[2],DEU!R[1]C[2],FIN!R[1]C[2],GBR!R[1]C[2],ITA!R[1]C[2],LUX!R[1]C[2],NLD!R[1]C[2],POL!R[1]C[2])*100 -> 27.125 | C6: =AVERAGE(BEL!R[1]C[2],DEU!R[1]C[2],FIN!R[1]C[2],GBR!R[1]C[2],ITA!R[1]C[2],LUX!R[1]C[2],NLD!R[1]C[2],POL!R[1]C[2])*100 -> 40 | D6: =AVERAGE(BEL!R[1]C[2],DEU!R[1]C[2],FIN!R[1]C[2],GBR!R[1]C[2],ITA!R[1]C[2],LUX!R[1]C[2],NLD!R[1]C[2],POL!R[1]C[2])*100 -> 145.625 | E6: =AVERAGE(BEL!R[1]C[2],DEU!R[1]C[2],FIN!R[1]C[2],GBR!R[1]C[2],ITA!R[1]C[2],LUX!R[1]C[2],NLD!R[1]C[2],POL!R[1]C[2])*100 -> 371.375 | F6: =AVERAGE(BEL!R[1]C[2],DEU!R[1]C[2],FIN!R[1]C[2],GBR!R[1]C[2],ITA!R[1]C[2],LUX!R[1]C[2],NLD!R[1]C[2],POL!R[1]C[2])*100 -> 168.87500000000003 | G6: =AVERAGE(BEL!R[1]C[2],DEU!R[1]C[2],FIN!R[1]C[2],GBR!R[1]C[2],ITA!R[1]C[2],LUX!R[1]C[2],NLD!R[1]C[2],POL!R[1]C[2])*100 -> 79.625 | H6: =AVERAGE(BEL!R[1]C[2],DEU!R[1]C[2],FIN!R[1]C[2],GBR!R[1]C[2],ITA!R[1]C[2],LUX!R[1]C[2],NLD!R[1]C[2],POL!R[1]C[2])*100 -> 70.75 | I6: =AVERAGE(BEL!R[1]C[2],DEU!R[1]C[2],FIN!R[1]C[2],GBR!R[1]C[2],ITA!R[1]C[2],LUX!R[1]C[2],NLD!R[1]C[2],POL!R[1]C[2])*100 -> 102.25 | J6: =AVERAGE(BEL!R[1]C[2],DEU!R[1]C[2],FIN!R[1]C[2],GBR!R[1]C[2],ITA!R[1]C[2],LUX!R[1]C[2],NLD!R[1]C[2],POL!R[1]C[2])*100 -> 89.625 | K6: =AVERAGE(BEL!R[1]C[2],DEU!R[1]C[2],FIN!R[1]C[2],GBR!R[1]C[2],ITA!R[1]C[2],LUX!R[1]C[2],NLD!R[1]C[2],POL!R[1]C[2])*100 -> 100.99999999999997 | L6: =AVERAGE(BEL!R[1]C[2],DEU!R[1]C[2],FIN!R[1]C[2],GBR!R[1]C[2],ITA!R[1]C[2],LUX!R[1]C[2],NLD!R[1]C[2],POL!R[1]C[2])*100 -> 65.125000000000014 | M6: =AVERAGE(BEL!R[1]C[2],DEU!R[1]C[2],FIN!R[1]C[2],GBR!R[1]C[2],ITA!R[1]C[2],LUX!R[1]C[2],NLD!R[1]C[2],POL!R[1]C[2])*100 -> 44.75 | N6: =AVERAGE(BEL!R[1]C[2],DEU!R[1]C[2],FIN!R[1]C[2],GBR!R[1]C[2],ITA!R[1]C[2],LUX!R[1]C[2],NLD!R[1]C[2],POL!R[1]C[2])*100 -> 30.5 | O6: =AVERAGE(BEL!R[1]C[2],DEU!R[1]C[2],FIN!R[1]C[2],GBR!R[1]C[2],ITA!R[1]C[2],LUX!R[1]C[2],NLD!R[1]C[2],POL!R[1]C[2])*100 -> 24.750000000000004
A7: =AVERAGE(BEL!R[1]C[2],DEU!R[1]C[2],FIN!R[1]C[2],GBR!R[1]C[2],ITA!R[1]C[2],LUX!R[1]C[2],NLD!R[1]C[2],POL!R[1]C[2])*100 -> 77.250000000000014 | B7: =AVERAGE(BEL!R[1]C[2],DEU!R[1]C[2],FIN!R[1]C[2],GBR!R[1]C[2],ITA!R[1]C[2],LUX!R[1]C[2],NLD!R[1]C[2],POL!R[1]C[2])*100 -> 65.25 | C7: =AVERAGE(BEL!R[1]C[2],DEU!R[1]C[2],FIN!R[1]C[2],GBR!R[1]C[2],ITA!R[1]C[2],LUX!R[1]C[2],NLD!R[1]C[2],POL!R[1]C[2])*100 -> 38.749999999999993 | D7: =AVERAGE(BEL!R[1]C[2],DEU!R[1]C[2],FIN!R[1]C[2],GBR!R[1]C[2],ITA!R[1]C[2],LUX!R[1]C[2],NLD!R[1]C[2],POL!R[1]C[2])*100 -> 67 | E7: =AVERAGE(BEL!R[1]C[2],DEU!R[1]C[2],FIN!R[1]C[2],GBR!R[1]C[2],ITA!R[1]C[2],LUX!R[1]C[2],NLD!R[1]C[2],POL!R[1]C[2])*100 -> 189.87500000000003 | F7: =AVERAGE(BEL!R[1]C[2],DEU!R[1]C[2],FIN!R[1]C[2],GBR!R[1]C[2],ITA!R[1]C[2],LUX!R[1]C[2],NLD!R[1]C[2],POL!R[1]C[2])*100 -> 247.62500000000003 | G7: =AVERAGE(BEL!R[1]C[2],DEU!R[1]C[2],FIN!R[1]C[2],GBR!R[1]C[2],ITA!R[1]C[2],LUX!R[1]C[2],NLD!R[1]C[2],POL!R[1]C[2])*100 -> 159.12499999999997 | H7: =AVERAGE(BEL!R[1]C[2],DEU!R[1]C[2],FIN!R[1]C[2],GBR!R[1]C[2],ITA!R[1]C[2],LUX!R[1]C[2],NLD!R[1]C[2],POL!R[1]C[2])*100 -> 116.625 | I7: =AVERAGE(BEL!R[1]C[2],DEU!R[1]C[2],FIN!R[1]C[2],GBR!R[1]C[2],ITA!R[1]C[2],LUX!R[1]C[2],NLD!R[1]C[2],POL!R[1]C[2])*100 -> 100.37499999999999 | J7: =AVERAGE(BEL!R[1]C[2],DEU!R[1]C[2],FIN!R[1]C[2],GBR!R[1]C[2],ITA!R[1]C[2],LUX!R[1]C[2],NLD!R[1]C[2],POL!R[1]C[2])*100 -> 103.875 | K7: =AVERAGE(BEL!R[1]C[2],DEU!R[1]C[2],FIN!R[1]C[2],GBR!R[1]C[2],ITA!R[1]C[2],LUX!R[1]C[2],NLD!R[1]C[2],POL!R[1]C[2])*100 -> 129.12499999999997 | L7: =AVERAGE(BEL!R[1]C[2],DEU!R[1]C[2],FIN!R[1]C[2],GBR!R[1]C[2],ITA!R[1]C[2],LUX!R[1]C[2],NLD!R[1]C[2],POL!R[1]C[2])*100 -> 91.875 | M7: =AVERAGE(BEL!R[1]C[2],DEU!R[1]C[2],FIN!R[1]C[2],GBR!R[1]C[2],ITA!R[1]C[2],LUX!R[1]C[2],NLD!R[1]C[2],POL!R[1]C[2])*100 -> 71.249999999999986 | N7: =AVERAGE(BEL!R[1]C[2],DEU!R[1]C[2],FIN!R[1]C[2],GBR!R[1]C[2],ITA!R[1]C[2],LUX!R[1]C[2],NLD!R[1]C[2],POL!R[1]C[2])*100 -> 58.25 | O7: =AVERAGE(BEL!R[1]C[2],DEU!R[1]C[2],FIN!R[1]C[2],GBR!R[1]C[2],ITA!R[1]C[2],LUX!R[1]C[2],NLD!R[1]C[2],POL!R[1]C[2])*100 -> 40.375000000000007
A8: =AVERAGE(BEL!R[1]C[2],DEU!R[1]C[2],FIN!R[1]C[2],GBR!R[1]C[2],ITA!R[1]C[2],LUX!R[1]C[2],NLD!R[1]C[2],POL!R[1]C[2])*100 -> 115.37499999999999 | B8: =AVERAGE(BEL!R[1]C[2],DEU!R[1]C[2],FIN!R[1]C[2],GBR!R[1]C[2],ITA!R[1]C[2],LUX!R[1]C[2],NLD!R[1]C[2],POL!R[1]C[2])*100 -> 96.625 | C8: =AVERAGE(BEL!R[1]C[2],DEU!R[1]C[2],FIN!R[1]C[2],GBR!R[1]C[2],ITA!R[1]C[2],LUX!R[1]C[2],NLD!R[1]C[2],POL!R[1]C[2])*100 -> 58.624999999999993 | D8: =AVERAGE(BEL!R[1]C[2],DEU!R[1]C[2],FIN!R[1]C[2],GBR!R[1]C[2],ITA!R[1]C[2],LUX!R[1]C[2],NLD!R[1]C[2],POL!R[1]C[2])*100 -> 52 | E8: =AVERAGE(BEL!R[1]C[2],DEU!R[1]C[2],FIN!R[1]C[2],GBR!R[1]C[2],ITA!R[1]C[2],LUX!R[1]C[2],NLD!R[1]C[2],POL!R[1]C[2])*100 -> 131.875 | F8: =AVERAGE(BEL!R[1]C[2],DEU!R[1]C[2],FIN!R[1]C[2],GBR!R[1]C[2],ITA!R[1]C[2],LUX!R[1]C[2],NLD!R[1]C[2],POL!R[1]C[2])*100 -> 165.875 | G8: =AVERAGE(BEL!R[1]C[2],DEU!R[1]C[2],FIN!R[1]C[2],GBR!R[1]C[2],ITA!R[1]C[2],LUX!R[1]C[2],NLD!R[1]C[2],POL!R[1]C[2])*100 -> 236.625 | H8: =AVERAGE(BEL!R[1]C[2],DEU!R[1]C[2],FIN!R[1]C[2],GBR!R[1]C[2],ITA!R[1]C[2],LUX!R[1]C[2],NLD!R[1]C[2],POL!R[1]C[2])*100 -> 154.875 | I8: =AVERAGE(BEL!R[1]C[2],DEU!R[1]C[2],FIN!R[1]C[2],GBR!R[1]C[2],ITA!R[1]C[2],LUX!R[1]C[2],NLD!R[1]C[2],POL!R[1]C[2])*100 -> 137.37499999999997 | J8: =AVERAGE(BEL!R[1]C[2],DEU!R[1]C[2],FIN!R[1]C[2],GBR!R[1]C[2],ITA!R[1]C[2],LUX!R[1]C[2],NLD!R[1]C[2],POL!R[1]C[2])*100 -> 118 | K8: =AVERAGE(BEL!R[1]C[2],DEU!R[1]C[2],FIN!R[1]C[2],GBR!R[1]C[2],ITA!R[1]C[2],LUX!R[1]C[2],NLD!R[1]C[2],POL!R[1]C[2])*100 -> 105.99999999999999 | L8: =AVERAGE(BEL!R[1]C[2],DEU!R[1]C[2],FIN!R[1]C[2],GBR!R[1]C[2],ITA!R[1]C[2],LUX!R[1]C[2],NLD!R[1]C[2],POL!R[1]C[2])*100 -> 107.5 | M8: =AVERAGE(BEL!R[1]C[2],DEU!R[1]C[2],FIN!R[1]C[2],GBR!R[1]C[2],ITA!R[1]C[2],LUX!R[1]C[2],NLD!R[1]C[2],POL!R[1]C[2])*100 -> 100.75 | N8: =AVERAGE(BEL!R[1]C[2],DEU!R[1]C[2],FIN!R[1]C[2],GBR!R[1]C[2],ITA!R[1]C[2],LUX!R[1]C[2],NLD!R[1]C[2],POL!R[1]C[2])*100 -> 68.75 | O8: =AVERAGE(BEL!R[1]C[2],DEU!R[1]C[2],FIN!R[1]C[2],GBR!R[1]C[2],ITA!R[1]C[2],LUX!R[1]C[2],NLD!R[1]C[2],POL!R[1]C[2])*100 -> 43.25
A9: =AVERAGE(BEL!R[1]C[2],DEU!R[1]C[2],FIN!R[1]C[2],GBR!R[1]C[2],ITA!R[1]C[2],LUX!R[1]C[2],NLD!R[1]C[2],POL!R[1]C[2])*100 -> 103 | B9: =AVERAGE(BEL!R[1]C[2],DEU!R[1]C[2],FIN!R[1]C[2],GBR!R[1]C[2],ITA!R[1]C[2],LUX!R[1]C[2],NLD!R[1]C[2],POL!R[1]C[2])*100 -> 119.875 | C9: =AVERAGE(BEL!R[1]C[2],DEU!R[1]C[2],FIN!R[1]C[2],GBR!R[1]C[2],ITA!R[1]C[2],LUX!R[1]C[2],NLD!R[1]C[2],POL!R[1]C[2])*100 -> 99.25 | D9: =AVERAGE(BEL!R[1]C[2],DEU!R[1]C[2],FIN!R[1]C[2],GBR!R[1]C[2],ITA!R[1]C[2],LUX!R[1]C[2],NLD!R[1]C[2],POL!R[1]C[2])*100 -> 80.25 | E9: =AVERAGE(BEL!R[1]C[2],DEU!R[1]C[2],FIN!R[1]C[2],GBR!R[1]C[2],ITA!R[1]C[2],LUX!R[1]C[2],NLD!R[1]C[2],POL!R[1]C[2])*100 -> 94.5 | F9: =AVERAGE(BEL!R[1]C[2],DEU!R[1]C[2],FIN!R[1]C[2],GBR!R[1]C[2],ITA!R[1]C[2],LUX!R[1]C[2],NLD!R[1]C[2],POL!R[1]C[2])*100 -> 120 | G9: =AVERAGE(BEL!R[1]C[2],DEU!R[1]C[2],FIN!R[1]C[2],GBR!R[1]C[2],ITA!R[1]C[2],LUX!R[1]C[2],NLD!R[1]C[2],POL!R[1]C[2])*100 -> 203.87499999999997 | H9: =AVERAGE(BEL!R[1]C[2],DEU!R[1]C[2],FIN!R[1]C[2],GBR!R[1]C[2],ITA!R[1]C[2],LUX!R[1]C[2],NLD!R[1]C[2],POL!R[1]C[2])*100 -> 241.74999999999994 | I9: =AVERAGE(BEL!R[1]C[2],DEU!R[1]C[2],FIN!R[1]C[2],GBR!R[1]C[2],ITA!R[1]C[2],LUX!R[1]C[2],NLD!R[1]C[2],POL!R[1]C[2])*100 -> 154.75 | J9: =AVERAGE(BEL!R[1]C[2],DEU!R[1]C[2],FIN!R[1]C[2],GBR!R[1]C[2],ITA!R[1]C[2],LUX!R[1]C[2],NLD!R[1]C[2],POL!R[1]C[2])*100 -> 133.875 | K9: =AVERAGE(BEL!R[1]C[2],DEU!R[1]C[2],FIN!R[1]C[2],GBR!R[1]C[2],ITA!R[1]C[2],LUX!R[1]C[2],NLD!R[1]C[2],POL!R[1]C[2])*100 -> 106.87500000000001 | L9: =AVERAGE(BEL!R[1]C[2],DEU!R[1]C[2],FIN!R[1]C[2],GBR!R[1]C[2],ITA!R[1]C[2],LUX!R[1]C[2],NLD!R[1]C[2],POL!R[1]C[2])*100 -> 93.125000000000014 | M9: =AVERAGE(BEL!R[1]C[2],DEU!R[1]C[2],FIN!R[1]C[2],GBR!R[1]C[2],ITA!R[1]C[2],LUX!R[1]C[2],NLD!R[1]C[2],POL!R[1]C[2])*100 -> 97.375000000000014 | N9: =AVERAGE(BEL!R[1]C[2],DEU!R[1]C[2],FIN!R[1]C[2],GBR!R[1]C[2],ITA!R[1]C[2],LUX!R[1]C[2],NLD!R[1]C[2],POL!R[1]C[2])*100 -> 86.375 | O9: =AVERAGE(BEL!R[1]C[2],DEU!R[1]C[2],FIN!R[1]C[2],GBR!R[1]C[2],ITA!R[1]C[2],LUX!R[1]C[2],NLD!R[1]C[2],POL!R[1]C[2])*100 -> 50.249999999999993
A10: =AVERAGE(BEL!R[1]C[2],DEU!R[1]C[2],FIN!R[1]C[2],GBR!R[1]C[2],ITA!R[1]C[2],LUX!R[1]C[2],NLD!R[1]C[2],POL!R[1]C[2])*100 -> 63.750000000000007 | B10: =AVERAGE(BEL!R[1]C[2],DEU!R[1]C[2],FIN!R[1]C[2],GBR!R[1]C[2],ITA!R[1]C[2],LUX!R[1]C[2],NLD!R[1]C[2],POL!R[1]C[2])*100 -> 112.25 | C10: =AVERAGE(BEL!R[1]C[2],DEU!R[1]C[2],FIN!R[1]C[2],GBR!R[1]C[2],ITA!R[1]C[2],LUX!R[1]C[2],NLD!R[1]C[2],POL!R[1]C[2])*100 -> 131.12499999999997 | D10: =AVERAGE(BEL!R[1]C[2],DEU!R[1]C[2],FIN!R[1]C[2],GBR!R[1]C[2],ITA!R[1]C[2],LUX!R[1]C[2],NLD!R[1]C[2],POL!R[1]C[2])*100 -> 99.499999999999986 | E10: =AVERAGE(BEL!R[1]C[2],DEU!R[1]C[2],FIN!R[1]C[2],GBR!R[1]C[2],ITA!R[1]C[2],LUX!R[1]C[2],NLD!R[1]C[2],POL!R[1]C[2])*100 -> 85.500000000000014 | F10: =AVERAGE(BEL!R[1]C[2],DEU!R[1]C[2],FIN!R[1]C[2],GBR!R[1]C[2],ITA!R[1]C[2],LUX!R[1]C[2],NLD!R[1]C[2],POL!R[1]C[2])*100 -> 99.500000000000014 | G10: =AVERAGE(BEL!R[1]C[2],DEU!R[1]C[2],FIN!R[1]C[2],GBR!R[1]C[2],ITA!R[1]C[2],LUX!R[1]C[2],NLD!R[1]C[2],POL!R[1]C[2])*100 -> 148.75 | H10: =AVERAGE(BEL!R[1]C[2],DEU!R[1]C[2],FIN!R[1]C[2],GBR!R[1]C[2],ITA!R[1]C[2],LUX!R[1]C[2],NLD!R[1]C[2],POL!R[1]C[2])*100 -> 201.24999999999997 | I10: =AVERAGE(BEL!R[1]C[2],DEU!R[1]C[2],FIN!R[1]C[2],GBR!R[1]C[2],ITA!R[1]C[2],LUX!R[1]C[2],NLD!R[1]C[2],POL!R[1]C[2])*100 -> 213.12499999999997 | J10: =AVERAGE(BEL!R[1]C[2],DEU!R[1]C[2],FIN!R[1]C[2],GBR!R[1]C[2],ITA!R[1]C[2],LUX!R[1]C[2],NLD!R[1]C[2],POL!R[1]C[2])*100 -> 152.75 | K10: =AVERAGE(BEL!R[1]C[2],DEU!R[1]C[2],FIN!R[1]C[2],GBR!R[1]C[2],ITA!R[1]C[2],LUX!R[1]C[2],NLD!R[1]C[2],POL!R[1]C[2])*100 -> 121.49999999999999 | L10: =AVERAGE(BEL!R[1]C[2],DEU!R[1]C[2],FIN!R[1]C[2],GBR!R[1]C[2],ITA!R[1]C[2],LUX!R[1]C[2],NLD!R[1]C[2],POL!R[1]C[2])*100 -> 111.99999999999999 | M10: =AVERAGE(BEL!R[1]C[2],DEU!R[1]C[2],FIN!R[1]C[2],GBR!R[1]C[2],ITA!R[1]C[2],LUX!R[1]C[2],NLD!R[1]C[2],POL!R[1]C[2])*100 -> 92.75 | N10: =AVERAGE(BEL!R[1]C[2],DEU!R[1]C[2],FIN!R[1]C[2],GBR!R[1]C[2],ITA!R[1]C[2],LUX!R[1]C[2],NLD!R[1]C[2],POL!R[1]C[2])*100 -> 86.000000000000014 | O10: =AVERAGE(BEL!R[1]C[2],DEU!R[1]C[2],FIN!R[1]C[2],GBR!R[1]C[2],ITA!R[1]C[2],LUX!R[1]C[2],NLD!R[1]C[2],POL!R[1]C[2])*100 -> 67.625
A11: =AVERAGE(BEL!R[1]C[2],DEU!R[1]C[2],FIN!R[1]C[2],GBR!R[1]C[2],ITA!R[1]C[2],LUX!R[1]C[2],NLD!R[1]C[2],POL!R[1]C[2])*100 -> 40.625 | B11: =AVERAGE(BEL!R[1]C[2],DEU!R[1]C[2],FIN!R[1]C[2],GBR!R[1]C[2],ITA!R[1]C[2],LUX!R[1]C[2],NLD!R[1]C[2],POL!R[1]C[2])*100 -> 51.749999999999993 | C11: =AVERAGE(BEL!R[1]C[2],DEU!R[1]C[2],FIN!R[1]C[2],GBR!R[1]C[2],ITA!R[1]C[2],LUX!R[1]C[2],NLD!R[1]C[2],POL!R[1]C[2])*100 -> 84.875 | D11: =AVERAGE(BEL!R[1]C[2],DEU!R[1]C[2],FIN!R[1]C[2],GBR!R[1]C[2],ITA!R[1]C[2],LUX!R[1]C[2],NLD!R[1]C[2],POL!R[1]C[2])*100 -> 120.00000000000001 | E11: =AVERAGE(BEL!R[1]C[2],DEU!R[1]C[2],FIN!R[1]C[2],GBR!R[1]C[2],ITA!R[1]C[2],LUX!R[1]C[2],NLD!R[1]C[2],POL!R[1]C[2])*100 -> 106.74999999999999 | F11: =AVERAGE(BEL!R[1]C[2],DEU!R[1]C[2],FIN!R[1]C[2],GBR!R[1]C[2],ITA!R[1]C[2],LUX!R[1]C[2],NLD!R[1]C[2],POL!R[1]C[2])*100 -> 92.5 | G11: =AVERAGE(BEL!R[1]C[2],DEU!R[1]C[2],FIN!R[1]C[2],GBR!R[1]C[2],ITA!R[1]C[2],LUX!R[1]C[2],NLD!R[1]C[2],POL!R[1]C[2])*100 -> 100.62500000000001 | H11: =AVERAGE(BEL!R[1]C[2],DEU!R[1]C[2],FIN!R[1]C[2],GBR!R[1]C[2],ITA!R[1]C[2],LUX!R[1]C[2],NLD!R[1]C[2],POL!R[1]C[2])*100 -> 125.62499999999999 | I11: =AVERAGE(BEL!R[1]C[2],DEU!R[1]C[2],FIN!R[1]C[2],GBR!R[1]C[2],ITA!R[1]C[2],LUX!R[1]C[2],NLD!R[1]C[2],POL!R[1]C[2])*100 -> 154.50000000000003 | J11: =AVERAGE(BEL!R[1]C[2],DEU!R[1]C[2],FIN!R[1]C[2],GBR!R[1]C[2],ITA!R[1]C[2],LUX!R[1]C[2],NLD!R[1]C[2],POL!R[1]C[2])*100 -> 186.375 | K11: =AVERAGE(BEL!R[1]C[2],DEU!R[1]C[2],FIN!R[1]C[2],GBR!R[1]C[2],ITA!R[1]C[2],LUX!R[1]C[2],NLD!R[1]C[2],POL!R[1]C[2])*100 -> 134.125 | L11: =AVERAGE(BEL!R[1]C[2],DEU!R[1]C[2],FIN!R[1]C[2],GBR!R[1]C[2],ITA!R[1]C[2],LUX!R[1]C[2],NLD!R[1]C[2],POL!R[1]C[2])*100 -> 100.125 | M11: =AVERAGE(BEL!R[1]C[2],DEU!R[1]C[2],FIN!R[1]C[2],GBR!R[1]C[2],ITA!R[1]C[2],LUX!R[1]C[2],NLD!R[1]C[2],POL!R[1]C[2])*100 -> 73.375000000000014 | N11: =AVERAGE(BEL!R[1]C[2],DEU!R[1]C[2],FIN!R[1]C[2],GBR!R[1]C[2],ITA!R[1]C[2],LUX!R[1]C[2],NLD!R[1]C[2],POL!R[1]C[2])*100 -> 56.25 | O11: =AVERAGE(BEL!R[1]C[2],DEU!R[1]C[2],FIN!R[1]C[2],GBR!R[1]C[2],ITA!R[1]C[2],LUX!R[1]C[2],NLD!R[1]C[2],POL!R[1]C[2])*100 -> 70
A12: =AVERAGE(BEL!R[1]C[2],DEU!R[1]C[2],FIN!R[1]C[2],GBR!R[1]C[2],ITA!R[1]C[2],LUX!R[1]C[2],NLD!R[1]C[2],POL!R[1]C[2])*100 -> 43 | B12: =AVERAGE(BEL!R[1]C[2],DEU!R[1]C[2],FIN!R[1]C[2],GBR!R[1]C[2],ITA!R[1]C[2],LUX!R[1]C[2],NLD!R[1]C[2],POL!R[1]C[2])*100 -> 40.625 | C12: =AVERAGE(BEL!R[1]C[2],DEU!R[1]C[2],FIN!R[1]C[2],GBR!R[1]C[2],ITA!R[1]C[2],LUX!R[1]C[2],NLD!R[1]C[2],POL!R[1]C[2])*100 -> 46.875 | D12: =AVERAGE(BEL!R[1]C[2],DEU!R[1]C[2],FIN!R[1]C[2],GBR!R[1]C[2],ITA!R[1]C[2],LUX!R[1]C[2],NLD!R[1]C[2],POL!R[1]C[2])*100 -> 61.749999999999993 | E12: =AVERAGE(BEL!R[1]C[2],DEU!R[1]C[2],FIN!R[1]C[2],GBR!R[1]C[2],ITA!R[1]C[2],LUX!R[1]C[2],NLD!R[1]C[2],POL!R[1]C[2])*100 -> 87.125 | F12: =AVERAGE(BEL!R[1]C[2],DEU!R[1]C[2],FIN!R[1]C[2],GBR!R[1]C[2],ITA!R[1]C[2],LUX!R[1]C[2],NLD!R[1]C[2],POL!R[1]C[2])*100 -> 101.875 | G12: =AVERAGE(BEL!R[1]C[2],DEU!R[1]C[2],FIN!R[1]C[2],GBR!R[1]C[2],ITA!R[1]C[2],LUX!R[1]C[2],NLD!R[1]C[2],POL!R[1]C[2])*100 -> 87.375 | H12: =AVERAGE(BEL!R[1]C[2],DEU!R[1]C[2],FIN!R[1]C[2],GBR!R[1]C[2],ITA!R[1]C[2],LUX!R[1]C[2],NLD!R[1]C[2],POL!R[1]C[2])*100 -> 98.625 | I12: =AVERAGE(BEL!R[1]C[2],DEU!R[1]C[2],FIN!R[1]C[2],GBR!R[1]C[2],ITA!R[1]C[2],LUX!R[1]C[2],NLD!R[1]C[2],POL!R[1]C[2])*100 -> 114.24999999999999 | J12: =AVERAGE(BEL!R[1]C[2],DEU!R[1]C[2],FIN!R[1]C[2],GBR!R[1]C[2],ITA!R[1]C[2],LUX!R[1]C[2],NLD!R[1]C[2],POL!R[1]C[2])*100 -> 131 | K12: =AVERAGE(BEL!R[1]C[2],DEU!R[1]C[2],FIN!R[1]C[2],GBR!R[1]C[2],ITA!R[1]C[2],LUX!R[1]C[2],NLD!R[1]C[2],POL!R[1]C[2])*100 -> 146.12500000000003 | L12: =AVERAGE(BEL!R[1]C[2],DEU!R[1]C[2],FIN!R[1]C[2],GBR!R[1]C[2],ITA!R[1]C[2],LUX!R[1]C[2],NLD!R[1]C[2],POL!R[1]C[2])*100 -> 123 | M12: =AVERAGE(BEL!R[1]C[2],DEU!R[1]C[2],FIN!R[1]C[2],GBR!R[1]C[2],ITA!R[1]C[2],LUX!R[1]C[2],NLD!R[1]C[2],POL!R[1]C[2])*100 -> 76.125 | N12: =AVERAGE(BEL!R[1]C[2],DEU!R[1]C[2],FIN!R[1]C[2],GBR!R[1]C[2],ITA!R[1]C[2],LUX!R[1]C[2],NLD!R[1]C[2],POL!R[1]C[2])*100 -> 59.375 | O12: =AVERAGE(BEL!R[1]C[2],DEU!R[1]C[2],FIN!R[1]C[2],GBR!R[1]C[2],ITA!R[1]C[2],LUX!R[1]C[2],NLD!R[1]C[2],POL!R[1]C[2])*100 -> 53.25
A13: =AVERAGE(BEL!R[1]C[2],DEU!R[1]C[2],FIN!R[1]C[2],GBR!R[1]C[2],ITA!R[1]C[2],LUX!R[1]C[2],NLD!R[1]C[2],POL!R[1]C[2])*100 -> 39.625 | B13: =AVERAGE(BEL!R[1]C[2],DEU!R[1]C[2],FIN!R[1]C[2],GBR!R[1]C[2],ITA!R[1]C[2],LUX!R[1]C[2],NLD!R[1]C[2],POL!R[1]C[2])*100 -> 31.75 | C13: =AVERAGE(BEL!R[1]C[2],DEU!R[1]C[2],FIN!R[1]C[2],GBR!R[1]C[2],ITA!R[1]C[2],LUX!R[1]C[2],NLD!R[1]C[2],POL!R[1]C[2])*100 -> 26.875 | D13: =AVERAGE(BEL!R[1]C[2],DEU!R[1]C[2],FIN!R[1]C[2],GBR!R[1]C[2],ITA!R[1]C[2],LUX!R[1]C[2],NLD!R[1]C[2],POL!R[1]C[2])*100 -> 33.5 | E13: =AVERAGE(BEL!R[1]C[2],DEU!R[1]C[2],FIN!R[1]C[2],GBR!R[1]C[2],ITA!R[1]C[2],LUX!R[1]C[2],NLD!R[1]C[2],POL!R[1]C[2])*100 -> 47.25 | F13: =AVERAGE(BEL!R[1]C[2],DEU!R[1]C[2],FIN!R[1]C[2],GBR!R[1]C[2],ITA!R[1]C[2],LUX!R[1]C[2],NLD!R[1]C[2],POL!R[1]C[2])*100 -> 66.625 | G13: =AVERAGE(BEL!R[1]C[2],DEU!R[1]C[2],FIN!R[1]C[2],GBR!R[1]C[2],ITA!R[1]C[2],LUX!R[1]C[2],NLD!R[1]C[2],POL!R[1]C[2])*100 -> 63.250000000000007 | H13: =AVERAGE(BEL!R[1]C[2],DEU!R[1]C[2],FIN!R[1]C[2],GBR!R[1]C[2],ITA!R[1]C[2],LUX!R[1]C[2],NLD!R[1]C[2],POL!R[1]C[2])*100 -> 56.000000000000007 | I13: =AVERAGE(BEL!R[1]C[2],DEU!R[1]C[2],FIN!R[1]C[2],GBR!R[1]C[2],ITA!R[1]C[2],LUX!R[1]C[2],NLD!R[1]C[2],POL!R[1]C[2])*100 -> 45.250000000000007 | J13: =AVERAGE(BEL!R[1]C[2],DEU!R[1]C[2],FIN!R[1]C[2],GBR!R[1]C[2],ITA!R[1]C[2],LUX!R[1]C[2],NLD!R[1]C[2],POL!R[1]C[2])*100 -> 69.75 | K13: =AVERAGE(BEL!R[1]C[2],DEU!R[1]C[2],FIN!R[1]C[2],GBR!R[1]C[2],ITA!R[1]C[2],LUX!R[1]C[2],NLD!R[1]C[2],POL!R[1]C[2])*100 -> 107.74999999999999 | L13: =AVERAGE(BEL!R[1]C[2],DEU!R[1]C[2],FIN!R[1]C[2],GBR!R[1]C[2],ITA!R[1]C[2],LUX!R[1]C[2],NLD!R[1]C[2],POL!R[1]C[2])*100 -> 155.125 | M13: =AVERAGE(BEL!R[1]C[2],DEU!R[1]C[2],FIN!R[1]C[2],GBR!R[1]C[2],ITA!R[1]C[2],LUX!R[1]C[2],NLD!R[1]C[2],POL!R[1]C[2])*100 -> 106.87500000000001 | N13: =AVERAGE(BEL!R[1]C[2],DEU!R[1]C[2],FIN!R[1]C[2],GBR!R[1]C[2],ITA!R[1]C[2],LUX!R[1]C[2],NLD!R[1]C[2],POL!R[1]C[2])*100 -> 65.375 | O13: =AVERAGE(BEL!R[1]C[2],DEU!R[1]C[2],FIN!R[1]C[2],GBR!R[1]C[2],ITA!R[1]C[2],LUX!R[1]C[2],NLD!R[1]C[2],POL!R[1]C[2])*100 -> 46.75
A14: =AVERAGE(BEL!R[1]C[2],DEU!R[1]C[2],FIN!R[1]C[2],GBR!R[1]C[2],ITA!R[1]C[2],LUX!R[1]C[2],NLD!R[1]C[2],POL!R[1]C[2])*100 -> 33.25 | B14: =AVERAGE(BEL!R[1]C[2],DEU!R[1]C[2],FIN!R[1]C[2],GBR!R[1]C[2],ITA!R[1]C[2],LUX!R[1]C[2],NLD!R[1]C[2],POL!R[1]C[2])*100 -> 29.874999999999996 | C14: =AVERAGE(BEL!R[1]C[2],DEU!R[1]C[2],FIN!R[1]C[2],GBR!R[1]C[2],ITA!R[1]C[2],LUX!R[1]C[2],NLD!R[1]C[2],POL!R[1]C[2])*100 -> 18 | D14: =AVERAGE(BEL!R[1]C[2],DEU!R[1]C[2],FIN!R[1]C[2],GBR!R[1]C[2],ITA!R[1]C[2],LUX!R[1]C[2],NLD!R[1]C[2],POL!R[1]C[2])*100 -> 15.75 | E14: =AVERAGE(BEL!R[1]C[2],DEU!R[1]C[2],FIN!R[1]C[2],GBR!R[1]C[2],ITA!R[1]C[2],LUX!R[1]C[2],NLD!R[1]C[2],POL!R[1]C[2])*100 -> 22.250000000000004 | F14: =AVERAGE(BEL!R[1]C[2],DEU!R[1]C[2],FIN!R[1]C[2],GBR!R[1]C[2],ITA!R[1]C[2],LUX!R[1]C[2],NLD!R[1]C[2],POL!R[1]C[2])*100 -> 37.875 | G14: =AVERAGE(BEL!R[1]C[2],DEU!R[1]C[2],FIN!R[1]C[2],GBR!R[1]C[2],ITA!R[1]C[2],LUX!R[1]C[2],NLD!R[1]C[2],POL!R[1]C[2])*100 -> 48.750000000000007 | H14: =AVERAGE(BEL!R[1]C[2],DEU!R[1]C[2],FIN!R[1]C[2],GBR!R[1]C[2],ITA!R[1]C[2],LUX!R[1]C[2],NLD!R[1]C[2],POL!R[1]C[2])*100 -> 57.124999999999993 | I14: =AVERAGE(BEL!R[1]C[2],DEU!R[1]C[2],FIN!R[1]C[2],GBR!R[1]C[2],ITA!R[1]C[2],LUX!R[1]C[2],NLD!R[1]C[2],POL!R[1]C[2])*100 -> 42.500000000000007 | J14: =AVERAGE(BEL!R[1]C[2],DEU!R[1]C[2],FIN!R[1]C[2],GBR!R[1]C[2],ITA!R[1]C[2],LUX!R[1]C[2],NLD!R[1]C[2],POL!R[1]C[2])*100 -> 41.000000000000007 | K14: =AVERAGE(BEL!R[1]C[2],DEU!R[1]C[2],FIN!R[1]C[2],GBR!R[1]C[2],ITA!R[1]C[2],LUX!R[1]C[2],NLD!R[1]C[2],POL!R[1]C[2])*100 -> 57.875000000000007 | L14: =AVERAGE(BEL!R[1]C[2],DEU!R[1]C[2],FIN!R[1]C[2],GBR!R[1]C[2],ITA!R[1]C[2],LUX!R[1]C[2],NLD!R[1]C[2],POL!R[1]C[2])*100 -> 82.5 | M14: =AVERAGE(BEL!R[1]C[2],DEU!R[1]C[2],FIN!R[1]C[2],GBR!R[1]C[2],ITA!R[1]C[2],LUX!R[1]C[2],NLD!R[1]C[2],POL!R[1]C[2])*100 -> 112.12499999999999 | N14: =AVERAGE(BEL!R[1]C[2],DEU!R[1]C[2],FIN!R[1]C[2],GBR!R[1]C[2],ITA!R[1]C[2],LUX!R[1]C[2],NLD!R[1]C[2],POL!R[1]C[2])*100 -> 83.375 | O14: =AVERAGE(BEL!R[1]C[2],DEU!R[1]C[2],FIN!R[1]C[2],GBR!R[1]C[2],ITA!R[1]C[2],LUX!R[1]C[2],NLD!R[1]C[2],POL!R[1]C[2])*100 -> 59.375000000000014
A15: =AVERAGE(BEL!R[1]C[2],DEU!R[1]C[2],FIN!R[1]C[2],GBR!R[1]C[2],ITA!R[1]C[2],LUX!R[1]C[2],NLD!R[1]C[2],POL!R[1]C[2])*100 -> 24.250000000000004 | B15: =AVERAGE(BEL!R[1]C[2],DEU!R[1]C[2],FIN!R[1]C[2],GBR!R[1]C[2],ITA!R[1]C[2],LUX!R[1]C[2],NLD!R[1]C[2],POL!R[1]C[2])*100 -> 21.374999999999996 | C15: =AVERAGE(BEL!R[1]C[2],DEU!R[1]C[2],FIN!R[1]C[2],GBR!R[1]C[2],ITA!R[1]C[2],LUX!R[1]C[2],NLD!R[1]C[2],POL!R[1]C[2])*100 -> 17.625 | D15: =AVERAGE(BEL!R[1]C[2],DEU!R[1]C[2],FIN!R[1]C[2],GBR!R[1]C[2],ITA!R[1]C[2],LUX!R[1]C[2],NLD!R[1]C[2],POL!R[1]C[2])*100 -> 12.75 | E15: =AVERAGE(BEL!R[1]C[2],DEU!R[1]C[2],FIN!R[1]C[2],GBR!R[1]C[2],ITA!R[1]C[2],LUX!R[1]C[2],NLD!R[1]C[2],POL!R[1]C[2])*100 -> 13 | F15: =AVERAGE(BEL!R[1]C[2],DEU!R[1]C[2],FIN!R[1]C[2],GBR!R[1]C[2],ITA!R[1]C[2],LUX!R[1]C[2],NLD!R[1]C[2],POL!R[1]C[2])*100 -> 18.875000000000004 | G15: =AVERAGE(BEL!R[1]C[2],DEU!R[1]C[2],FIN!R[1]C[2],GBR!R[1]C[2],ITA!R[1]C[2],LUX!R[1]C[2],NLD!R[1]C[2],POL!R[1]C[2])*100 -> 25.875000000000004 | H15: =AVERAGE(BEL!R[1]C[2],DEU!R[1]C[2],FIN!R[1]C[2],GBR!R[1]C[2],ITA!R[1]C[2],LUX!R[1]C[2],NLD!R[1]C[2],POL!R[1]C[2])*100 -> 41.25 | I15: =AVERAGE(BEL!R[1]C[2],DEU!R[1]C[2],FIN!R[1]C[2],GBR!R[1]C[2],ITA!R[1]C[2],LUX!R[1]C[2],NLD!R[1]C[2],POL!R[1]C[2])*100 -> 30.124999999999996 | J15: =AVERAGE(BEL!R[1]C[2],DEU!R[1]C[2],FIN!R[1]C[2],GBR!R[1]C[2],ITA!R[1]C[2],LUX!R[1]C[2],NLD!R[1]C[2],POL!R[1]C[2])*100 -> 21.375 | K15: =AVERAGE(BEL!R[1]C[2],DEU!R[1]C[2],FIN!R[1]C[2],GBR!R[1]C[2],ITA!R[1]C[2],LUX!R[1]C[2],NLD!R[1]C[2],POL!R[1]C[2])*100 -> 24.125000000000004 | L15: =AVERAGE(BEL!R[1]C[2],DEU!R[1]C[2],FIN!R[1]C[2],GBR!R[1]C[2],ITA!R[1]C[2],LUX!R[1]C[2],NLD!R[1]C[2],POL!R[1]C[2])*100 -> 47.375 | M15: =AVERAGE(BEL!R[1]C[2],DEU!R[1]C[2],FIN!R[1]C[2],GBR!R[1]C[2],ITA!R[1]C[2],LUX!R[1]C[2],NLD!R[1]C[2],POL!R[1]C[2])*100 -> 69.5 | N15: =AVERAGE(BEL!R[1]C[2],DEU!R[1]C[2],FIN!R[1]C[2],GBR!R[1]C[2],ITA!R[1]C[2],LUX!R[1]C[2],NLD!R[1]C[2],POL!R[1]C[2])*100 -> 90.125 | O15: =AVERAGE(BEL!R[1]C[2],DEU!R[1]C[2],FIN!R[1]C[2],GBR!R[1]C[2],ITA!R[1]C[2],LUX!R[1]C[2],NLD!R[1]C[2],POL!R[1]C[2])*100 -> 66.125
A16: =AVERAGE(BEL!R[1]C[2],DEU!R[1]C[2],FIN!R[1]C[2],GBR!R[1]C[2],ITA!R[1]C[2],LUX!R[1]C[2],NLD!R[1]C[2],POL!R[1]C[2])*100 -> 31.625000000000004 | B16: =AVERAGE(BEL!R[1]C[2],DEU!R[1]C[2],FIN!R[1]C[2],GBR!R[1]C[2],ITA!R[1]C[2],LUX!R[1]C[2],NLD!R[1]C[2],POL!R[1]C[2])*100 -> 35.874999999999993 | C16: =AVERAGE(BEL!R[1]C[2],DEU!R[1]C[2],FIN!R[1]C[2],GBR!R[1]C[2],ITA!R[1]C[2],LUX!R[1]C[2],NLD!R[1]C[2],POL!R[1]C[2])*100 -> 36.25 | D16: =AVERAGE(BEL!R[1]C[2],DEU!R[1]C[2],FIN!R[1]C[2],GBR!R[1]C[2],ITA!R[1]C[2],LUX!R[1]C[2],NLD!R[1]C[2],POL!R[1]C[2])*100 -> 25 | E16: =AVERAGE(BEL!R[1]C[2],DEU!R[1]C[2],FIN!R[1]C[2],GBR!R[1]C[2],ITA!R[1]C[2],LUX!R[1]C[2],NLD!R[1]C[2],POL!R[1]C[2])*100 -> 31.499999999999993 | F16: =AVERAGE(BEL!R[1]C[2],DEU!R[1]C[2],FIN!R[1]C[2],GBR!R[1]C[2],ITA!R[1]C[2],LUX!R[1]C[2],NLD!R[1]C[2],POL!R[1]C[2])*100 -> 35.875 | G16: =AVERAGE(BEL!R[1]C[2],DEU!R[1]C[2],FIN!R[1]C[2],GBR!R[1]C[2],ITA!R[1]C[2],LUX!R[1]C[2],NLD!R[1]C[2],POL!R[1]C[2])*100 -> 37.625 | H16: =AVERAGE(BEL!R[1]C[2],DEU!R[1]C[2],FIN!R[1]C[2],GBR!R[1]C[2],ITA!R[1]C[2],LUX!R[1]C[2],NLD!R[1]C[2],POL!R[1]C[2])*100 -> 43.75 | I16: =AVERAGE(BEL!R[1]C[2],DEU!R[1]C[2],FIN!R[1]C[2],GBR!R[1]C[2],ITA!R[1]C[2],LUX!R[1]C[2],NLD!R[1]C[2],POL!R[1]C[2])*100 -> 56.124999999999993 | J16: =AVERAGE(BEL!R[1]C[2],DEU!R[1]C[2],FIN!R[1]C[2],GBR!R[1]C[2],ITA!R[1]C[2],LUX!R[1]C[2],NLD!R[1]C[2],POL!R[1]C[2])*100 -> 68.5 | K16: =AVERAGE(BEL!R[1]C[2],DEU!R[1]C[2],FIN!R[1]C[2],GBR!R[1]C[2],ITA!R[1]C[2],LUX!R[1]C[2],NLD!R[1]C[2],POL!R[1]C[2])*100 -> 70.875 | L16: =AVERAGE(BEL!R[1]C[2],DEU!R[1]C[2],FIN!R[1]C[2],GBR!R[1]C[2],ITA!R[1]C[2],LUX!R[1]C[2],NLD!R[1]C[2],POL!R[1]C[2])*100 -> 72.375000000000014 | M16: =AVERAGE(BEL!R[1]C[2],DEU!R[1]C[2],FIN!R[1]C[2],GBR!R[1]C[2],ITA!R[1]C[2],LUX!R[1]C[2],NLD!R[1]C[2],POL!R[1]C[2])*100 -> 89.000000000000014 | N16: =AVERAGE(BEL!R[1]C[2],DEU!R[1]C[2],FIN!R[1]C[2],GBR!R[1]C[2],ITA!R[1]C[2],LUX!R[1]C[2],NLD!R[1]C[2],POL!R[1]C[2])*100 -> 105 | O16: =AVERAGE(BEL!R[1]C[2],DEU!R[1]C[2],FIN!R[1]C[2],GBR!R[1]C[2],ITA!R[1]C[2],LUX!R[1]C[2],NLD!R[1]C[2],POL!R[1]C[2])*100 -> 145